favorite_count,source,text,in_reply_to_screen_name,is_retweet,created_at,retweet_count,id_str
1,TweetDeck,"@lindsayhickman_ @SCEMD Noon today in Charleston, Dorchester, and Berkeley Counties and Edisto Beach. https://t.co/p9OrvRcL7T",lindsayhickman_,False,Sat Sep 15 15:10:52 +0000 2018,0,1040981282900123648
8,TweetDeck,@Zachary_Cohen You're not alone.,Zachary_Cohen,False,Mon Nov 20 17:34:17 +0000 2017,1,932663400072704002
0,TweetDeck,@KelseyWrenn @MountPleasantPD @CityCharleston Noon today. https://t.co/p9OrvRcL7T,KelseyWrenn,False,Sat Sep 15 15:09:50 +0000 2018,0,1040981020558938112
45,Twitter for iPhone,"We owe a debt of gratitude to all involved who acted so quickly and decisively.

For months, I have called on the G… https://t.co/uRCrJeXZ2t",henrymcmaster,False,Thu Mar 15 02:51:55 +0000 2018,9,974115948755120128
0,TweetDeck,@iamstaceyb4 Depends on where it is. Try starting with the office of the municipality in which it's located (e.g. C… https://t.co/2CVDZPRxAz,iamstaceyb4,False,Thu Nov 16 17:47:25 +0000 2017,0,931217153809899520
612,Twitter Web Client,Tomorrow is Election Day and Pamela and I are asking for your vote. Support proven conservative leaders by voting M… https://t.co/J2KaFtS9mI,,False,Mon Nov 05 18:39:49 +0000 2018,216,1059515644910043136
28,Twitter for iPhone,One child abused is one too many; every child in South Carolina deserves to live a happy life. I’m proud to proclai… https://t.co/nFziO2DM2u,,False,Thu Apr 05 19:55:29 +0000 2018,13,981983683786788867
13,TweetDeck,"Any time a company invests in our state, it shows a commitment to our citizens that we couldn’t be more grateful fo… https://t.co/Bfd0s1F99O",,False,Thu Nov 16 15:01:28 +0000 2017,2,931175393918406656
61,Twitter Web Client,I want to make sure I come home safely to my wonderful wife Peggy and our loving bulldog Mac. Why do you buckle up?… https://t.co/sVoH33hVp0,,False,Thu May 17 14:30:36 +0000 2018,12,997122217606434816
79,Twitter for iPhone,It was my honor to present the Order of the Palmetto to one of the most revered investigators in S.C. law enforceme… https://t.co/2TodlHw1Ch,,False,Fri Jul 20 21:57:18 +0000 2018,20,1020427456031977472
164,Twitter Web Client,"This is huge news for our campaign! @GovMikeHuckabee is a conservative stalwart, and I am honored to have him in my… https://t.co/yVUAGSN1Om",,False,Thu Jun 21 23:29:23 +0000 2018,87,1009941378225397761
70,TweetDeck,"When you see the flags at half staff today please pause to remember Corporal Chapman, a brave hero who laid down hi… https://t.co/GH88Imd5Fd",,False,Wed Dec 13 14:32:40 +0000 2017,20,940952614786740224
32,Twitter for iPhone,We’re rolling! #SCWinning Bus Tour is underway. First stop of the day: Rock Hill. https://t.co/PPNbUeVDFy,,False,Wed Jun 06 14:35:59 +0000 2018,8,1004371326503673858
21,Twitter Web Client,I want to make sure that every part of our state is sharing in the great prosperity that South Carolina has. The S.… https://t.co/rLFMueRzs9,,False,Tue Mar 06 19:49:20 +0000 2018,7,971110501785767936
6,Twitter Web Client,https://t.co/i4RkQ5aKlT,,False,Thu Jan 25 00:13:21 +0000 2018,4,956319039134998528
31,Twitter Web Client,Their presence in North Charleston is about as welcome as a Category 5 hurricane. With more South Carolinians worki… https://t.co/K4WO4AMSkx,henrymcmaster,False,Mon May 21 22:15:29 +0000 2018,8,998688757107843072
93,Twitter for iPhone,"His enthusiasm is infectious, his vision bright and bold, his passion and energy transformative, and his heart as b… https://t.co/3UjX4WPDhn",henrymcmaster,False,Wed Oct 03 16:18:14 +0000 2018,28,1047521214279950336
56,TweetDeck,"I have lifted the mandatory evacuation order for zones in Beaufort, Colleton, and Jasper counties, with the excepti… https://t.co/ZflZzfVEIh",,False,Tue Sep 11 15:48:30 +0000 2018,37,1039541201723174913
43,Twitter for iPhone,"Dillon Team South Carolina Day is today! If you need help recovering from Hurricane Florence, stop by 536 Radford B… https://t.co/JniQ4yE3vJ",,False,Tue Oct 16 14:10:28 +0000 2018,16,1052200105560944642
189,TweetDeck,"Rev. Billy Graham dedicated his life to preaching the Gospel, touching the lives of millions across the world. It i… https://t.co/KKr8xrugi2",,False,Wed Feb 21 14:27:34 +0000 2018,53,966318482072711168
148,Twitter for iPhone,"As you look at the flag today and see it at half-staff, please take a moment to remember Sergeant First Class Chris… https://t.co/rqaFpjDVHG",,False,Wed Jul 18 17:59:21 +0000 2018,36,1019642796775333888
30,TweetDeck,"I will be delivering my State of the State address this Wednesday, January 17 at 7pm. It will be carried live by… https://t.co/cEz2GICAyf",,False,Mon Jan 15 17:22:00 +0000 2018,23,952954029855858688
18,Twitter Web Client,Thankful for the generous support of South Carolinians all across the state. On to victory! https://t.co/oJLyKBu8v6,,False,Thu Jan 11 17:22:09 +0000 2018,9,951504515173269504
9,Twitter for iPhone,It is always a pleasure to spend time in the Lowcountry hearing directly from voters and sharing our message that S… https://t.co/xzHOgXfjEx,,False,Tue May 15 00:28:44 +0000 2018,3,996185577937620992
11,TweetDeck,Evacuees should pack the following essential items in anticipation of a potentially prolonged evacuation period: re… https://t.co/CdnjCJ6ytw,henrymcmaster,False,Tue Sep 11 15:50:01 +0000 2018,3,1039541581026680832
50,Twitter for iPhone,Wishing you and your family the happiest of thanksgivings! https://t.co/paSrk7Dfhi,,False,Thu Nov 23 21:16:26 +0000 2017,6,933806471329939457
4918,TweetDeck,This is simply devastating news from Florence. The selfless acts of bravery from the men and women in law enforceme… https://t.co/PQvb6gu1NH,,False,Wed Oct 03 22:34:34 +0000 2018,1690,1047615925078425600
1005,TweetDeck,@nikkihaley is a tremendous leader who has done great things for South Carolina as governor and for the US as ambas… https://t.co/IovqiGCwqT,AmbNikkiHaley,False,Tue Oct 09 16:09:36 +0000 2018,177,1049693368400392194
35,Twitter Web Client,This morning I spoke with the East Cooper Republican Club about what we've accomplished for South Carolina and what… https://t.co/q47dlLV0gy,,False,Mon Jun 18 17:53:19 +0000 2018,17,1008769641781456896
305,Twitter for iPhone,I am honored to have the full support of President Donald Trump. He will go down as one of the greatest presidents… https://t.co/Dzkb9y57En,,False,Sat Jun 09 20:48:23 +0000 2018,135,1005552208073633792
63,Twitter Web Client,Proven leadership coupled with 21st century ideas and vision is what it takes to usher in an era of unparalleled gr… https://t.co/JquQwwWtTs,,False,Thu Mar 22 22:01:58 +0000 2018,28,976942083297521664
21,Twitter for iPhone,It was a pleasure to spend time with hundreds of committed party leaders at the Spartanburg Co. GOP Bronze Elephant… https://t.co/3vXe8LDD4a,,False,Sat May 12 13:38:34 +0000 2018,5,995297180389953536
43,Twitter for iPhone,With sad hearts we lower the flag today to remember the lives of 26 individuals senselessly killed in Sutherland Sp… https://t.co/zSMKtXIw55,,False,Mon Nov 06 15:34:38 +0000 2017,13,927559859867811840
61,Twitter Web Client,This is why I love being on the campaign trail--meeting great South Carolinians across the state. I hope to earn yo… https://t.co/5K0yt3ALJ8,,False,Mon Jun 25 00:53:29 +0000 2018,24,1011049709807525888
78,Twitter for iPhone,The “King” Richard Petty @RPMotorsports will have his iconic @OriginalSTP 43 colors on @BubbaWallace car tonight… https://t.co/2TlKEJS533,,False,Sun Sep 02 22:19:51 +0000 2018,17,1036378195489107974
49,Twitter for iPhone,Glad to have my friend @RepTomRice on the road with me today sharing our message of #SCWinning. We just had a delic… https://t.co/NmHpuLrC23,,False,Sat Jun 09 14:53:28 +0000 2018,18,1005462889086554113
43,Twitter for iPhone,We just wrapped up our first #SCWinning stop at Seneca Family Restaurant. Thank you to our supporters who joined us… https://t.co/q8HGA1cXz5,,False,Thu Jun 21 14:03:54 +0000 2018,12,1009799071345840128
274,Twitter for iPhone,The transformative leadership of President @realDonaldTrump has the Korean peninsula on the precipice of peace. The… https://t.co/g6tXWzPFOx,,False,Tue Jun 12 18:55:08 +0000 2018,73,1006610870691123201
34,Twitter Web Client,I am proud to have an honorable and conservative leader like @RepTomRice on our team. More people are working than… https://t.co/98SR5whR3L,,False,Tue Jun 05 16:39:33 +0000 2018,9,1004040035979681793
151,Twitter Web Client,"Planned Parenthood sees me as a threat to their existence--and they should! As VP @mike_pence said, I will ALWAYS s… https://t.co/IDBrWgpngS",,False,Mon Jun 25 14:51:37 +0000 2018,56,1011260631251652608
17,Twitter for iPhone,"Thanks to the leadership of Chairman Greg Delleney, bill sponsor Rep. @BruceBannister and Reps @syllestedavis,… https://t.co/CDwDs8ewcZ",henrymcmaster,False,Tue Mar 20 23:06:02 +0000 2018,6,976233433780375552
128,Twitter Web Client,"With more than 23,000 new jobs and $8 billion in economic investment, we are taking South Carolina to even greater… https://t.co/ydrbHfyLok",,False,Thu Nov 01 18:05:39 +0000 2018,42,1058057494419783681
408,Twitter for iPhone,We are heartbroken tonight to lose another officer as a result of the horrific shooting in Florence. Investigator F… https://t.co/V0PLRKdJLs,,False,Tue Oct 23 01:26:09 +0000 2018,149,1054544474075000833
64,Twitter Web Client,Only 100 days left until Election Day. Join the fight for South Carolina today and VOLUNTEER with the winning team!… https://t.co/uuiovSH807,,False,Sun Jul 29 22:39:21 +0000 2018,34,1023699527193133056
28,Twitter for iPhone,"Thank you, @real_wylieshaw! https://t.co/PwbehzPO9E",,False,Tue Aug 21 18:39:15 +0000 2018,6,1031974026531487744
109,Twitter for iPhone,"20,000 Sprinter vans proudly made by South Carolinians in North Charleston. #TeamSouthCarolina #SCJobs #SCWinning https://t.co/I9aJgBa4L2",,False,Wed Sep 05 22:04:48 +0000 2018,22,1037461570627018753
50,Twitter for iPhone,This morning I met with the staff of Daybreak Lifecare Center and pro-life leaders to stand up against the abortion… https://t.co/SLtVkBQCQ6,,False,Tue May 29 15:19:46 +0000 2018,11,1001483241835126784
72,Twitter for iPhone,President @realdonaldtrump has dealt with lies like this on the campaign trail &amp; now in the White House from Democr… https://t.co/lzswd7lXnD,,False,Fri Jun 15 19:30:02 +0000 2018,17,1007706819588968448
15,Twitter Web Client,"Some issues, from divine rights of kings to ownership of people, take years of struggle to right, but afterwards we… https://t.co/jk2Twmp5CB",,False,Wed Jan 24 16:55:05 +0000 2018,6,956208746589499393
11,Twitter Web Client,https://t.co/Lu1AhqJMoV,,False,Thu Jan 25 00:15:42 +0000 2018,2,956319632247279616
89,Twitter Web Client,"Today we are remembering the life of John McCain. Sailor, Senator, father, husband, hero, and friend. Please take a… https://t.co/tKdhBp9OKe",,False,Sat Sep 01 14:02:38 +0000 2018,31,1035890680734855170
70,Twitter for iPhone,A great day in South Carolina for #BojanglesSouthern500 @TooToughToTame - Track President @Kerry_Tharp is nation’s… https://t.co/cu5OWXNU53,,False,Sun Sep 02 17:44:13 +0000 2018,19,1036308828277465089
62,Twitter Web Client,Our students deserve to have a Superintendent of Education with a seat in the cabinet working in lock step with the… https://t.co/Moop9kuoVN,,False,Wed Oct 31 19:03:07 +0000 2018,19,1057709571517628416
13,Twitter Web Client,Honored to have your support! Make sure you're on our team here: https://t.co/uXU3lgRCfC https://t.co/tCd9Yo4CMn,,False,Fri Dec 15 21:20:30 +0000 2017,6,941780027732934656
51,Twitter Web Client,"In tonight's debate, you'll hear my opponents make empty promises. But my campaign is about results. Since I've bee… https://t.co/hudnJ8zLOt",,False,Tue Jun 05 19:22:15 +0000 2018,18,1004080981886763010
20,Twitter Web Client,"Thank you, @SenatorTimScott, for your leadership in championing legislation that encourages long-term investment in… https://t.co/WczawcwgiL",,False,Wed Feb 14 17:50:05 +0000 2018,6,963832734761205760
15,Twitter Web Client,"Anytime a company is able to grow and expand its operations, especially in one of our rural counties, it proves wha… https://t.co/dsIy9lXR3S",,False,Fri Feb 23 17:37:42 +0000 2018,3,967091109510963203
80,TweetDeck,Public schools and state offices will be closed beginning tomorrow until further notice in twenty six counties: Aik… https://t.co/7GOc9ndERm,henrymcmaster,False,Mon Sep 10 20:01:03 +0000 2018,87,1039242369508548608
3161,TweetDeck,"Peggy and I ask that you pray for them, pray for their recovery, pray for their families, and pray for all of Florence. (2/2)",henrymcmaster,False,Wed Oct 03 22:34:43 +0000 2018,978,1047615960616718336
138,Twitter Web Client,Our economy is strong and getting stronger! I am proud to lead Team South Carolina as we work with officials from a… https://t.co/LleUAyx0NY,,False,Wed Aug 01 22:30:58 +0000 2018,46,1024784582640513024
203,TweetDeck,When you see the flags at half-staff today please take a moment to remember Detective Michael R. Doty https://t.co/C04XmnIvOA,,False,Mon Jan 22 14:31:10 +0000 2018,68,955447751730434048
112,Twitter Web Client,"South Carolina is strong! As your governor, I will continue our fight to grow good-paying jobs, keep our people saf… https://t.co/SA8Kpv3iTG",,False,Wed Jun 13 23:52:52 +0000 2018,35,1007048186819743744
62,TweetDeck,"Today we remember an American hero we recently lost, Specialist Javion S. Sullivan. On behalf of a grateful nation,… https://t.co/lCboJAfOq4",,False,Fri Jan 26 13:29:24 +0000 2018,18,956881761207758850
28,TweetDeck,"Chief Keel has served our state with great honor, integrity, and leadership for many years, and there is no one mor… https://t.co/xHy6cY1bKZ",,False,Wed Jan 31 19:02:45 +0000 2018,10,958777592655597569
64,Twitter for iPhone,We had a fantastic time at @RepJeffDuncan’s Faith &amp; Freedom BBQ tonight. Every year this event brings together cons… https://t.co/M9SrH2BfbL,,False,Tue Aug 28 01:10:24 +0000 2018,24,1034246787052261378
19,Twitter for iPhone,"From US Navy submarines to Olympic torches, the people at ASCO Valve in Aiken make high end components used around… https://t.co/IZeEnptPuA",,False,Mon Feb 12 22:21:34 +0000 2018,1,963176278378631168
6,TweetDeck,Evacuation shelter locations for those evacuating from the state’s northern and central coastal counties will be av… https://t.co/NpK19fTKdf,henrymcmaster,False,Tue Sep 11 15:49:32 +0000 2018,2,1039541462147522561
3,Twitter for iPhone,"After meeting with Republican Women groups this morning, I had the opportunity to meet several young professionals… https://t.co/TQ17IuL0wO",henrymcmaster,False,Tue May 15 00:28:53 +0000 2018,0,996185612989411328
75,Twitter Web Client,"As long as I’m your governor, I will not allow anyone to take away your religious liberties. Today I signed an exec… https://t.co/HtYb9hHHff",,False,Tue Mar 13 23:03:12 +0000 2018,16,973696006356287488
88,Twitter for iPhone,"President Trump is right, the best way out of poverty is a job. Welfare assistance should be seen as a temporary me… https://t.co/dbYVIXzEvB",,False,Wed Apr 11 15:54:09 +0000 2018,43,984097280088268803
58,Twitter for iPhone,That they are both willing to come and campaign to keep South Carolina moving forward is a testament to the success… https://t.co/ufnRLuayMd,henrymcmaster,False,Wed Jun 20 02:51:55 +0000 2018,14,1009267575518388224
158,Twitter Web Client,"I hope everyone has an opportunity to reflect on the sacrifice Christ made for us this #GoodFriday. 
 
May His suff… https://t.co/5WhspImjMI",,False,Fri Mar 30 22:18:55 +0000 2018,35,979845455524892673
13,Twitter for iPhone,"Our state’s manufacturing industry continues to impress, and having a global name like Stanley Black &amp; Decker call… https://t.co/vZmo2eHRrO",henrymcmaster,False,Thu Dec 14 16:09:24 +0000 2017,3,941339348624134145
44,Twitter for iPhone,Day 3 of our #SCWinning bus tour has begun with a great breakfast in Florence! @PamelaEvette has a special message… https://t.co/KYgQhBk82D,,False,Fri Nov 02 13:45:00 +0000 2018,15,1058354289960214528
116,TweetDeck,The S.C. Senate just took a major step towards making sure there will NEVER be a sanctuary city in our great state.… https://t.co/mVizMacU7o,,False,Thu Apr 12 19:21:07 +0000 2018,23,984511753047412736
22,Twitter Web Client,https://t.co/A3WGd6wy7x,,False,Thu Jan 25 00:28:22 +0000 2018,6,956322819809280001
39,Twitter for iPhone,Today I had the pleasure of welcoming students from Rudolph Gordon Elementary in Simpsonville during their field tr… https://t.co/lfLneXtFML,,False,Tue May 22 17:34:35 +0000 2018,9,998980455985827845
6,TweetDeck,Over seven hundred thousand electric cooperative customers face the prospect of having their power bills sky rocket… https://t.co/R0MZ2qa1IJ,henrymcmaster,False,Wed Jan 03 14:49:56 +0000 2018,2,948567106286735360
10,Twitter for iPhone,Last stop of the day was @chasngop meeting. Thank you for inviting me to speak to your members and take important q… https://t.co/V95odowx4N,henrymcmaster,False,Tue May 15 00:52:09 +0000 2018,5,996191471278678017
9,Twitter for iPhone,Kudos to @PalmettoPromise Team - they provide great research. This @santeecooper report should be required reading… https://t.co/mw4FbvHDuV,,False,Wed Mar 21 03:05:43 +0000 2018,2,976293751965405187
410,Twitter Web Client,"The #SCWinning bus tour concluded after 5 days, 16 stops, and meeting with thousands of voters. With the future of… https://t.co/eAzcP08WPC",,False,Mon Nov 05 20:32:53 +0000 2018,132,1059544099508826112
55,TweetDeck,The men and women who crew the fleet of C-17s in Charleston are heading to Ft. Polk tomorrow to participate in read… https://t.co/YyurHMtNLc,,False,Mon May 21 19:41:01 +0000 2018,15,998649887343497216
92,Twitter Web Client,I was blessed with the privilege of conferring upon Mrs. Donella Brown Wilson the Order of the Palmetto. If anyone… https://t.co/JFPCv3lo0l,,False,Sat Jan 13 02:15:47 +0000 2018,27,952001198210670592
71,TweetDeck,"I’ve said it before, and I’ll say it again: Send me a bill that ensures South Carolina ratepayers will not pay a si… https://t.co/pryHOYkbZn",,False,Tue Mar 27 22:16:50 +0000 2018,24,978757766155300864
51,Twitter for iPhone,Last stop of the day: Spartanburg! Thank you to everyone for coming out to support our campaign today. #SCWinning https://t.co/U3AnlUvz79,,False,Sat Nov 03 00:39:13 +0000 2018,18,1058518929046491136
32,TweetDeck,"Stay warm and stay safe, South Carolina. Please check in with @SCEMD for updates: https://t.co/1GnQW0yTrX",,False,Wed Jan 03 16:47:17 +0000 2018,22,948596639555604480
5,TweetDeck,Mr. Pough has worked tirelessly during his time at DJJ to implement needed changes at the agency. I look forward to… https://t.co/1hOJmpcJTE,,False,Thu Nov 16 20:16:53 +0000 2017,0,931254769431339008
239,Twitter for iPhone,We are in the final stretch and our supporters are excited to get out and vote tomorrow! We made stops in the Lowco… https://t.co/xgLrjLEK9V,,False,Mon Jun 25 18:06:47 +0000 2018,99,1011309748501860352
22,Twitter Web Client,"Good luck, Tigers! #ClemsonGRIT https://t.co/MJTWLUZ4v5",,False,Fri Mar 23 23:09:37 +0000 2018,8,977321498649051136
73,Twitter Web Client,It took bipartisan leadership in both the House and the Senate to get the extremely important tax conformity bill t… https://t.co/NQ0RkQ32xd,,False,Wed Oct 03 21:57:13 +0000 2018,23,1047606521788551169
44,Twitter for iPhone,Every asset in the state is being directed towards this region as they are bracing for and experiencing historic fl… https://t.co/H8xfJhTFqd,henrymcmaster,False,Sun Sep 23 01:57:05 +0000 2018,16,1043680622273875968
150,Twitter for iPhone,"I am honored by your friendship and support, Mr. President. On behalf of South Carolinians everywhere, we look forw… https://t.co/OLmiBuZXNQ",,False,Thu Jun 21 13:32:48 +0000 2018,43,1009791243235352577
8,TweetDeck,"The only way to resolve this travesty is to sell Santee Cooper. There is more work to be done, but today, we are he… https://t.co/sU2oAgA2kg",henrymcmaster,False,Wed Jan 03 14:50:12 +0000 2018,2,948567174779752448
59,Twitter for iPhone,"S.C. businesses and taxpayers have been well served by action taken today by the Senate, and the leadership shown b… https://t.co/Mw6EsdK9ht",,False,Tue Oct 02 20:00:40 +0000 2018,19,1047214805612822529
15,Twitter for iPhone,This puts us even closer to Americans getting the reform they deserve and businesses having the capital to create more jobs for our people.,henrymcmaster,False,Sat Dec 02 16:04:02 +0000 2017,5,936989342207234048
63,Twitter for iPhone,"We’re on our way to Charleston where we’ll rally our Lowcountry supporters &amp; celebrate a huge win for our state.

T… https://t.co/E8hn2yJiQK",,False,Thu Jun 07 20:40:32 +0000 2018,14,1004825456347148289
118,Twitter Web Client,"We will NOT have Sanctuary Cities in South Carolina. I will cut taxes, we will have no income taxes for our retired… https://t.co/riZbrahOXK",,False,Wed May 23 23:35:42 +0000 2018,20,999433721727008768
20,Twitter for iPhone,We believe this executive order gives Director Stirling the tools the department needs to properly compensate the b… https://t.co/aj7FxYth48,,False,Mon Apr 23 19:32:56 +0000 2018,10,988500990277160960
41,Twitter Web Client,"I look at what’s going on in the universities, you can hardly express your own opinion, exercising your first amend… https://t.co/SegSHOH7sW",,False,Wed May 23 23:45:52 +0000 2018,12,999436280378228736
13,Twitter for iPhone,We also talked with several small business owners in downtown Fort Mill who support our campaign and know that I ha… https://t.co/kRKjLQF7lX,henrymcmaster,False,Fri Nov 02 20:16:08 +0000 2018,4,1058452722515693568
66,Twitter Web Client,"We are #SCWinning here in Spartanburg and across the state! Our team is unlike any other, and I am proud to have su… https://t.co/YF7TJ0BFnO",,False,Mon Jun 18 22:29:13 +0000 2018,16,1008839076705947650
63,Twitter for iPhone,I ask you to keep South Carolina working and winning by casting your vote for me today. Polls are open from 7am-7pm… https://t.co/V3WCq69w32,,False,Tue Jun 12 11:04:40 +0000 2018,31,1006492474683084800
34,Twitter for iPhone,Great turnout for our Get-Out-The-Vote rally in Mt. Pleasant! Our team is fired up to vote on Tuesday to keep SC re… https://t.co/S0yazpZtTO,,False,Thu Nov 01 18:40:53 +0000 2018,15,1058066363862921217
99,Twitter for iPhone,Planned Parenthood can celebrate all they want - but as long as I’m Governor abortion clinics will not receive one… https://t.co/J97VBdD6lG,,False,Wed Apr 18 23:53:00 +0000 2018,22,986754501297262594
73,Twitter for iPhone,I enjoyed meeting with the @SCGOP and our Lowcountry Republican leaders as we chart our course to victory in Novemb… https://t.co/LE6v9eF0wa,,False,Fri Aug 10 00:58:18 +0000 2018,18,1027720762805964800
93,Twitter Ads,"My opponent, James Smith, supports abortion on demand and fought against a bill to ban dismemberment abortions. Jam… https://t.co/PnUjFi5erQ",,False,Tue Oct 23 17:29:03 +0000 2018,39,1054786794254823425
69,Twitter Web Client,Gov. McMaster is the ONLY candidate in this race endorsed by the NRA. https://t.co/lur4InVqsl,,False,Wed May 23 23:51:49 +0000 2018,20,999437776691986433
74,Twitter Web Client,Happy to confer upon Mr. Cecil Williams the Order of the Palmetto. Mr. Williams has been documenting South Carolina… https://t.co/a0puQVl9qd,,False,Tue Dec 12 18:23:54 +0000 2017,26,940648420922019845
33,Twitter for iPhone,There are more important priorities the SC Senate budget should address- like funding certified law enforcement (re… https://t.co/Uw462EMjCo,henrymcmaster,False,Thu Apr 12 02:11:18 +0000 2018,4,984252587347251205
12,TweetDeck,"As I've been saying for over a month, SCANA must do two things:

1. Stop charging customers for a failed nuclear pr… https://t.co/2AySylZWYy",,False,Thu Nov 16 20:36:58 +0000 2017,5,931259822942670848
22,Twitter Web Client,This was truly a #TeamSouthCarolina effort and wouldn't have been possible w/o the herculean effort of our federal… https://t.co/c1PLqiz6Gn,henrymcmaster,False,Thu Jun 07 14:25:14 +0000 2018,5,1004731009726865410
24,Twitter Web Client,"Minimally adequate education bears no relation to what we are going to provide to our children, they will all get t… https://t.co/jotijB5wiM",,False,Wed Jan 24 18:30:23 +0000 2018,13,956232730001526790
39,Twitter for iPhone,Great to be in Charleston for GOTV. The economy here is booming and the new federal funding for the Port deepening… https://t.co/OJJRDSuxhF,,False,Mon Jun 11 16:55:56 +0000 2018,15,1006218487663079425
67,Twitter Web Client,Thank you @realDonaldTrump for signing federal legislation that will complement the work we are doing in South Caro… https://t.co/sre7GbQctc,,False,Wed Oct 24 20:32:47 +0000 2018,12,1055195420564115456
47,Twitter Web Client,Companies are coming from all over the world to South Carolina because of our highly-skilled workforce—and that sta… https://t.co/RrsXbtieFP,,False,Wed Mar 07 16:36:55 +0000 2018,14,971424465765748736
48,Twitter for iPhone,Today I joined emergency officials from across the state for our annual hurricane preparedness tabletop exercise. T… https://t.co/KaF4SCOcrT,,False,Tue May 08 21:21:21 +0000 2018,15,993964094720966667
70,Twitter for iPhone,"With more than 24,000 new jobs and &amp; $8 billion in new investment, South Carolina is booming! We are taking our mes… https://t.co/RXuCFfRWSH",,False,Mon Nov 05 17:18:42 +0000 2018,23,1059495230284668929
13,TweetDeck,"In 2015, we passed our own version of this law in South Carolina because we value and protect life, especially that… https://t.co/6hEqc8w5jO",henrymcmaster,False,Mon Jan 29 21:16:58 +0000 2018,6,958086593658736640
