favorite_count,source,text,in_reply_to_screen_name,is_retweet,created_at,retweet_count,id_str
107,Twitter Web Client,"James Smith said he supports Bernie Sanders' $32 TRILLION government-run health care plan, but refuses to say how w… https://t.co/vbL1QqvAy3",,False,Thu Oct 11 17:06:49 +0000 2018,42,1050432544129208320
14,TweetDeck,I applaud the House for taking this historic first step and urge the Senate to pass it without delay. (5/5),henrymcmaster,False,Tue Apr 03 20:12:37 +0000 2018,4,981263219342929922
101,Twitter for iPhone,Tonight I told thousands of proud South Carolinians why we’re #SCWinning! Thank you @CCMFLive for having me. Y’all… https://t.co/HnyDtahhAC,,False,Sat Jun 09 02:32:00 +0000 2018,34,1005276295209672704
51,TweetDeck,"After years of fighting for reform, the people of South Carolina will finally have the opportunity to vote to bring… https://t.co/onU7LQZAX4",,False,Thu May 10 21:49:33 +0000 2018,23,994695965025230852
9,Twitter for iPhone,and the General Assembly passed nine bills that I happily signed to bolster our efforts to fight this scourge. (3/4),henrymcmaster,False,Thu Sep 06 21:09:31 +0000 2018,0,1037810045327736835
57,Twitter for iPhone,"While we were blessed with a year without losing any firefighters, it is still important to remember those who have… https://t.co/s1VAl0WPOl",,False,Fri Apr 13 18:32:07 +0000 2018,19,984861806853263365
90,Twitter for iPhone,Just surveyed the Wando bridge in person. The replacement cable has arrived. SCDOT working around the clock to fix… https://t.co/5RSl911IrK,,False,Wed May 16 20:12:08 +0000 2018,33,996845775618543621
182,Twitter Ads Composer,"Today, America celebrates 242 years of freedom. I hope all South Carolinians enjoy a safe and happy Independence Da… https://t.co/tU6rx5DrGx",,False,Wed Jul 04 12:31:00 +0000 2018,31,1014486734783033344
43,Twitter for iPhone,"It's women like Mrs. Bush that make our nation strong, and her presence will be missed. (2/2)",henrymcmaster,False,Wed Apr 18 00:27:14 +0000 2018,10,986400726086832132
81,Twitter Web Client,Job growth under @POTUS ​is soaring! We're seeing similar economic success here in South Carolina--check out my web… https://t.co/a8devqRjaR,,False,Fri Mar 09 22:32:09 +0000 2018,34,972238638833573888
104,Twitter for iPhone,We had a great time in Darlington celebrating @TooToughToTame and are excited about returning for another… https://t.co/cxLYWdLIUz,,False,Wed Aug 15 13:50:09 +0000 2018,29,1029726945246945281
79,Twitter Web Client,"Peggy and I are excited for the debate. Make sure to tune in here, happening now: https://t.co/wfH1T0sjhg https://t.co/aNspX1iXIz",,False,Wed Oct 17 22:59:47 +0000 2018,18,1052695698171285505
63,Twitter for iPhone,Thank you for your hard work! #SCWinning #23Days https://t.co/0TzTFIAwRk,,False,Sun Oct 14 21:59:25 +0000 2018,15,1051593342964916226
80,TweetDeck,Thank you @TreasurerLoftis for your quick response to our request for funding for mosquito abatement in the afterma… https://t.co/09QoWcwLz9,,False,Thu Oct 04 21:13:18 +0000 2018,22,1047957859059867650
60,Twitter Web Client,Happy Mother's Day to my beautiful wife Peggy and to all of the hard-working moms across our great state! https://t.co/xiOp3UQXqI,,False,Sun May 13 18:39:40 +0000 2018,6,995735342790541312
46,Twitter Web Client,I believe that human life begins at conception. That’s why in August I directed state agencies to stop providing st… https://t.co/iEsD0R4spr,,False,Thu Jan 25 00:34:54 +0000 2018,18,956324465628950528
40,Twitter for iPhone,"Good morning, York County! You carried us the first go around and I hope you will get out and vote again on Tuesday… https://t.co/PCZybf5ArN",,False,Fri Jun 22 12:56:43 +0000 2018,11,1010144550441103361
503,TweetDeck,"I have ordered a full coastal evacuation effective noon tomorrow, Tuesday, September 11. If you are unsure if you a… https://t.co/CPR8dQjjz4",,False,Mon Sep 10 19:53:12 +0000 2018,343,1039240393584402432
13,TweetDeck,"We are making progress. Under the proposed agreement between SCANA and Dominion Energy, SCE&amp;G ratepayers will get m… https://t.co/L3hrNd30Ce",,False,Wed Jan 03 14:49:39 +0000 2018,2,948567035344228352
424,Twitter for iPhone,"I just spoke with Katie’s husband, Rob. We are shocked by the news of her accident and urge all South Carolinians t… https://t.co/2hQM0EqB7e",,False,Sat Jun 23 13:09:41 +0000 2018,139,1010510201848549377
1073,Twitter for iPhone,Anything short of a full retraction &amp; apology from @SEC and @Mizzou is an insult to every South Carolinian.… https://t.co/6mxwF9f23M,,False,Sat Feb 24 17:58:29 +0000 2018,324,967458726419615744
13,Twitter Web Client,"Pamela is a mother and wife, a business owner, a woman of strong faith, and a product of the American dream. She’s… https://t.co/btyruR02nr",henrymcmaster,False,Tue Nov 28 21:46:31 +0000 2017,3,935625978755219456
30,Twitter for iPhone,I look forward to joining the Greenville Co. GOP Bronze Elephant Dinner &amp; Candidate Forum tonight at 7pm. Friends i… https://t.co/0mjssO9kQx,,False,Tue May 01 21:43:08 +0000 2018,5,991432861520711682
78,Twitter Web Client,"This Presidents Day, I hope everyone takes time to reflect on the many great leaders who have served our country. I… https://t.co/Vv14guMqd4",,False,Mon Feb 19 21:36:20 +0000 2018,8,965701608683311111
113,Twitter for iPhone,"We also ask that you pray for Rep. Arrington’s friend, Jacqueline Goff, who is recovering from serious injuries, an… https://t.co/wA7XMJNy4M",henrymcmaster,False,Sat Jun 23 16:21:31 +0000 2018,29,1010558478333685760
23,Twitter Web Client,As I said tonight in my first State of the State address as governor: South Carolina is strong. https://t.co/fn0197Q3Zk,,False,Thu Jan 25 00:56:58 +0000 2018,11,956330016106733568
42,Twitter Web Client,"We just wrapped up a great second day of our #SCWinning bus tour. We met with supporters in Rock Hill, Florence, Co… https://t.co/N7d4jbFIg0",,False,Sat Jun 23 02:06:36 +0000 2018,10,1010343332340535296
22,TweetDeck,"South Carolina is growing as a leader in global connectivity, and today’s announcement by Frontier Logistics will o… https://t.co/eLyZweXZbS",,False,Tue Feb 06 19:06:31 +0000 2018,10,960952867719966720
78,Twitter for iPhone,"We’re proud to stand with you, Governor. Together, with the clear direction from our @POTUS, we will secure the bor… https://t.co/6GNyPZc2nf",,False,Sat May 12 18:07:57 +0000 2018,22,995364974984945664
109,Twitter for iPhone,Peggy and I had a great time celebrating @ClemsonUniv homecoming with President Clements today! https://t.co/sl47JZ3uRX,,False,Sat Oct 20 21:30:15 +0000 2018,25,1053760331653242881
115,Twitter Web Client,"Wishing a very happy birthday to my friend and our president, @realDonaldTrump! https://t.co/7JzDK899Rn",,False,Thu Jun 14 18:11:39 +0000 2018,32,1007324704913281024
80,Twitter for iPhone,"Thank you, @votejohnwarren! We are happy to have you on our team. As we rally together at the @SCGOP Silver Elephan… https://t.co/hG3BsFpYBZ",,False,Sat Jul 28 00:09:10 +0000 2018,27,1022997356646735873
7569,Twitter Web Client,"In his #SOTU  @POTUS honored our heroes who put their lives on the line to keep us safe. As I said, standing for ou… https://t.co/EA0frm0mkg",,False,Wed Jan 31 03:46:09 +0000 2018,1552,958546921781473281
27,Twitter for iPhone,We had a great time on the campaign trail today! Thank you to Manning Kimmel for having me on @WRHI and to all our… https://t.co/uSw0NMMgHX,,False,Fri May 25 01:10:08 +0000 2018,10,999819875982987266
52,Twitter Web Client,I am honored to have the endorsement of law enforcement officials who have dedicated their lives to keeping the peo… https://t.co/ykeodtuRYB,,False,Fri Jun 01 16:23:58 +0000 2018,11,1002586562545291265
167,Twitter Web Client,"VP @Mike_Pence wants you to get out and VOTE Henry McMaster this Tuesday, June 26th! #SCWinning https://t.co/ry8JYWxuC5",,False,Mon Jun 25 01:33:57 +0000 2018,77,1011059892940083200
13,TweetDeck,"If SCE&amp;G ratepayers shouldn't be charged, then neither should the co-op customers of Santee Cooper. That's what I h… https://t.co/5tQ0VHyelp",,False,Fri Feb 23 22:14:46 +0000 2018,6,967160834634977280
23,Twitter Web Client,"With nearly 10% of South Carolina jobs tied to @SCPorts, today marks a monumental step forward in expanding our sta… https://t.co/DmLdsMaTYu",,False,Fri Mar 02 17:38:19 +0000 2018,8,969627979381813249
44,Twitter Ads Composer,"Far-left liberal James Smith has been endorsed by Planned Parenthood, the largest provider of abortion services in… https://t.co/hl76ysGF0J",,False,Wed May 16 13:15:00 +0000 2018,12,996740803014811648
74,Twitter Web Client,We're cutting taxes for every South Carolinian. My plan reduces the state income tax by $2.2 billion. Let's get it… https://t.co/sO46jI4PME,,False,Wed Jan 10 21:47:50 +0000 2018,19,951208991983480832
21,Twitter for iPhone,Thank you for having me! https://t.co/GdIxDT8grD,,False,Thu Sep 27 20:26:31 +0000 2018,2,1045409369200963585
41,TweetDeck,"""[Volvo] plans to produce the vehicles in the U.S. as well...just outside Charleston, South Carolina""

Looking forw… https://t.co/WMnfiYpk6Q",,False,Mon Nov 20 17:27:25 +0000 2017,17,932661673978146816
96,Twitter Web Client,President Trump promised to nominate conservative judges who will strictly follow the Constitution and exercise res… https://t.co/J7rTsmHW1O,henrymcmaster,False,Tue Jul 10 01:31:19 +0000 2018,35,1016495048785969153
191,Twitter for iPhone,"I had a great time at the White House last night with my friend, President @realDonaldTrump! We talked about our sh… https://t.co/pjA7tsIpIB",,False,Tue May 22 12:08:10 +0000 2018,54,998898311351369728
102,Twitter Web Client,"You are a good man, but you are not Donald Trump! https://t.co/nbLwbgZ28X",,False,Wed Jun 20 23:26:37 +0000 2018,35,1009578295950741505
223,Twitter for iPhone,We’re feeling great after a HUGE victory tonight! South Carolina is WINNING and it’s clear people are excited to bu… https://t.co/qXwCCB2n49,,False,Wed Jun 13 02:44:15 +0000 2018,71,1006728928671731712
46,TweetDeck,"As a former Reagan-appointed U.S. attorney &amp; SC attorney general, I have the experience to protect our state from s… https://t.co/4FKt0Z9dMY",,False,Mon May 07 20:01:16 +0000 2018,12,993581551580536832
115,TweetDeck,"James Smith believes that raising your taxes is the ""right thing to do."" But I want to cut your taxes &amp; keep your h… https://t.co/Rg1v15F40X",,False,Thu Aug 30 22:03:29 +0000 2018,46,1035286914033700865
1024,Twitter for iPhone,I am honored that President @realDonaldTrump came to South Carolina to campaign for me. You heard the man — get out… https://t.co/rBVGTyb9e4,,False,Tue Jun 26 01:18:28 +0000 2018,443,1011418382908915712
17,TweetDeck,I am hopeful the House will make a similar commitment to school safety in their budget before leaving town this week. (2/2),henrymcmaster,False,Tue Mar 13 18:37:18 +0000 2018,4,973629088492675072
171,Twitter for iPhone,Heroism knows no age limits. I’m proud to confer upon Malachi Coffey the Order of the Silver Crescent. If you haven… https://t.co/EtEmroUIKj,,False,Wed Apr 25 19:51:57 +0000 2018,32,989230552849973248
33,TweetDeck,Santee Cooper acted illegally in canceling their scheduled meeting. It is a shameful attempt to thwart efforts to i… https://t.co/dSgDvqnNhR,,False,Mon Aug 20 17:23:12 +0000 2018,13,1031592498567806976
47,Twitter for iPhone,The good people of Camden showed up big for the winning team today. Thank you for the support! #SCWinning https://t.co/werevYQfOA,,False,Fri Nov 02 17:00:44 +0000 2018,17,1058403545165258752
83,TweetDeck,"There are South Carolinians in need right now, and as always, the National Guard is ready, willing, and able to ans… https://t.co/o1aq5qdnvm",,False,Thu Jan 04 17:02:52 +0000 2018,40,948962948847947776
13,Twitter Ads,"This Thursday, at 11 AM at the State House, I will be hosting a Vietnam Veterans Commemoration Event. I hope you an… https://t.co/jwj5MYWIIB",,False,Wed Mar 28 18:18:47 +0000 2018,4,979060248374755328
315,Twitter Web Client,"LIVE: President Trump in Columbia asking South Carolinians to VOTE for Henry McMaster tomorrow, June 26th. https://t.co/1pOaQtGtlW",,False,Tue Jun 26 00:06:28 +0000 2018,133,1011400265675595776
84,Twitter for iPhone,"Potential tragedy was avoided at AC Flora High School. In two separate incidents, students and educators reacted qu… https://t.co/AIf91Uoh9L",,False,Thu Mar 15 02:51:13 +0000 2018,16,974115773718454272
39,Twitter for iPhone,Thank you to all our supporters in the Upstate! This is the winning team and we are fired up for tomorrow. I hope t… https://t.co/lQPDyqYxr5,,False,Mon Jun 11 20:21:07 +0000 2018,10,1006270124196843520
114,Twitter for iPhone,Thank you to our great Vice President @Mike_Pence for coming to South Carolina! I appreciate his support to keep… https://t.co/wfuub4Qny2,,False,Sat Jun 23 22:11:07 +0000 2018,30,1010646459035906055
37,Twitter for iPhone,"Thank you, Horry County! We just wrapped up our last stop in the Grand Strand before Election Day. Get out and VOTE… https://t.co/GrXsJ6FGYK",,False,Mon Jun 11 13:58:34 +0000 2018,16,1006173849963122688
15,Twitter for iPhone,"Thank you to my fantastic running mate, @PamEvette, for speaking on behalf of our campaign at the Horry Co. GOP Ral… https://t.co/Qcf4GngOOi",,False,Tue May 08 01:46:10 +0000 2018,4,993668350751408128
12,TweetDeck,To continue to allow utilities to charge South Carolinians for the failed project at VC Summer when we have the abi… https://t.co/r5cCZfVXyL,,False,Wed Mar 07 17:45:04 +0000 2018,4,971441614274129932
27,Twitter for iPhone,"THANK YOU, Aiken! — “He's the only candidate endorsed by the @NRA, the only candidate endorsed by @LIFEforSC, &amp; of… https://t.co/TcZB8a85hT",,False,Thu Jun 07 19:39:50 +0000 2018,20,1004810182315134979
19,Twitter Web Client,It's an important step that will protect the foster licenses of @MiracleHill and other faith-based foster care orga… https://t.co/oI9d5N3q2m,henrymcmaster,False,Tue Mar 13 23:03:13 +0000 2018,2,973696008231112704
120,Twitter for iPhone,Heading to our last official stop of the day: a Bikers for Trump rally at the Beaver Bar in Murrells Inlet. But we… https://t.co/klio4eQROh,,False,Fri Jun 08 22:04:55 +0000 2018,34,1005209081735413760
96,Twitter Web Client,Democrats in the Senate should do what is right for the country and join their Republican colleagues in confirming… https://t.co/nWiOmJb1JU,henrymcmaster,False,Tue Jul 10 01:31:20 +0000 2018,39,1016495051470352384
45,Twitter Web Client,"✔ 130 New Jobs
✔ $8 million investment
 
Magna International's announcement today marks another victory for South C… https://t.co/sFBCSW52El",,False,Mon Mar 26 19:56:15 +0000 2018,15,978359997988978689
32,TweetDeck,Santee Cooper is saddled with $8B dollars in debt-$4.3B of it comes from the failed VC Summer project. The leadersh… https://t.co/t2iZsh2XkH,,False,Tue Apr 03 20:10:27 +0000 2018,7,981262676344102914
19,Twitter for iPhone,The 2018 Governor’s Opioid Summit gave us the opportunity not only to discuss solutions to the issues still facing… https://t.co/qOIWVLGbrc,,False,Thu Sep 06 21:09:29 +0000 2018,1,1037810039480885248
26,Twitter for iPhone,Please join in thanking them for their service and praying for their safety and success in their mission. (2/2),henrymcmaster,False,Fri May 11 17:23:14 +0000 2018,8,994991332711116800
82,Twitter for iPhone,"Hey @mike_pence, your biggest fans are in South Carolina! #SCWinning https://t.co/ASaHemdxW5",,False,Fri Nov 02 17:24:57 +0000 2018,12,1058409641506414592
30,TweetDeck,I want to thank the General Assembly for passing the automatic stay bill and look forward to signing it. In South C… https://t.co/PXAf61Qque,,False,Tue Feb 27 21:30:21 +0000 2018,5,968599207765532672
8,TweetDeck,I will order that flags be flown at half-staff on the day of his funeral. (3/3),henrymcmaster,False,Mon Dec 04 18:47:15 +0000 2017,8,937755191889350657
13,TweetDeck,Nephron’s commitment to growing and expanding its operations in W. Cola and investing in South Carolinians is somet… https://t.co/RHSF2bwI8r,,False,Wed Dec 06 20:49:43 +0000 2017,8,938510788725215233
94,Twitter for iPhone,Ready to roll! #ChapinLaborDayParade https://t.co/VenyNNppLt,,False,Mon Sep 03 13:26:23 +0000 2018,18,1036606331761958913
128,Twitter Web Client,"My opponent, James Smith, has been courting big-name Democrat socialists like Bernie Sanders and Cory Booker. Who w… https://t.co/DdJiFSsF7l",,False,Wed Oct 17 20:31:16 +0000 2018,57,1052658322296299520
15,TweetDeck,"Today, we celebrate another success for one of South Carolina’s existing industries. With this expansion, Van Dyke’… https://t.co/cTDiN4NYaK",,False,Wed Feb 07 15:41:29 +0000 2018,8,961263655743643649
10,Twitter Web Client,That’s why in S.C. I issued an executive order declaring it a statewide public health emergency and creating the Op… https://t.co/dLZmmeDuon,henrymcmaster,False,Mon Mar 19 20:10:23 +0000 2018,5,975826841998102529
165,Twitter for iPhone,He is risen! Peggy and I hope that all South Carolinians have a blessed Easter with their loved ones.,,False,Sun Apr 01 17:26:43 +0000 2018,12,980496697120952323
32,Twitter Web Client,"I had the privilege of meeting with Miss Ava Rose Olsen today, a survivor of the Townville shooting. She shared her… https://t.co/SlFA6HVAAe",,False,Wed Feb 28 20:55:17 +0000 2018,8,968952770173853696
8,TweetDeck,@SCEMD You can watch video of the announcement here: https://t.co/ZQqHG74pUt,henrymcmaster,False,Mon Dec 18 19:46:49 +0000 2017,2,942843615461511168
22,Twitter for iPhone,"My wonderful daughter, Mary Rogers, and @PamelaEvette's daughter Amanda joined us on stage to welcome the crowd. Th… https://t.co/xZAJSpJDVt",henrymcmaster,False,Tue May 15 00:28:59 +0000 2018,4,996185641179283457
115,TweetDeck,There's no way we will ever be able to repay these men and women in uniform for the true value they add to our stat… https://t.co/LzY9JQfoOV,,False,Fri Jan 05 18:33:40 +0000 2018,47,949348188603011073
21,Twitter Web Client,Thank you to the doctors and first responders who joined me to recognize May as Stroke Awareness Month in South Car… https://t.co/lTLuOeRxKw,,False,Wed May 09 14:50:43 +0000 2018,4,994228173662547970
69,Twitter Web Client,"Today, I filed to run for another term as your governor and continue serving the greatest state in the country.
It… https://t.co/pel2xIIQPS",,False,Tue Mar 20 18:27:56 +0000 2018,17,976163445320990720
56,TweetDeck,"#ICYMI On Friday we announced that Team SC has added more than 100,000 jobs since Nikki Haley took office. I am pro… https://t.co/hj5ChWlbY5",,False,Mon May 21 16:29:05 +0000 2018,16,998601583352012800
38,Twitter for iPhone,"Honored to have the endorsement of 35 local leaders in the Lowcountry. This is the A-Team, and with their support w… https://t.co/w6FfQNa0kj",,False,Mon Jun 18 19:23:57 +0000 2018,15,1008792449488248834
25,Twitter Ads,"Just announced: 200 new jobs and $52 million investment. 

With our business-friendly climate and booming economy,… https://t.co/Ob2hfgJkQo",,False,Thu Mar 08 18:04:03 +0000 2018,11,971808780089409536
87,Twitter Ads,"Since I’ve stripped state funding for Planned Parenthood, they’ve made me their target. They know that I will stop… https://t.co/fok2CqUwGg",,False,Tue May 15 12:03:00 +0000 2018,16,996360295240159233
7,Twitter Web Client,https://t.co/GX1LsLjFux,,False,Thu Jan 25 00:47:14 +0000 2018,3,956327568864567296
21,Twitter for iPhone,Remember our local elections today! Polls close @ 7PM. Don’t forget to vote! https://t.co/n3ZggVXGVy https://t.co/zH4EFRihfn,,False,Tue Nov 07 22:26:34 +0000 2017,9,928025912687452160
43,Twitter Web Client,"Today, the House took an important step toward ensuring South Carolinians' safety. Thank you for supporting my plan… https://t.co/vZyLVrWFuq",,False,Thu Mar 08 22:39:44 +0000 2018,12,971878159879585792
20,Twitter Web Client,Here’s the point: Let’s let the taxpayers keep their money.,henrymcmaster,False,Thu Jan 25 00:41:21 +0000 2018,11,956326086744289280
64,Twitter for iPhone,South Carolina’s strong military tradition is unlike any other state. We support our veterans and will continue wor… https://t.co/rM6ZQZGOUW,,False,Thu Nov 01 20:51:57 +0000 2018,24,1058099345822769152
62,Twitter for iPhone,It was my humble honor to confer upon Medal of Honor recipient Gen. James Livingston the Order of the Palmetto. https://t.co/3YgeCW2AG9,,False,Fri May 18 11:11:34 +0000 2018,11,997434514279424000
15,TweetDeck,"South Carolina is full of talented people, and that’s why we know a company like Tree Brand Packaging can succeed h… https://t.co/2Q9RxmPuJu",,False,Wed Jan 10 20:21:39 +0000 2018,5,951187302381957121
83,TweetDeck,A sad day to hear of the passing of the inimitable Charles Krauthammer. He greatly contributed to our national dial… https://t.co/lSqmFtbh8O,,False,Fri Jun 22 01:31:28 +0000 2018,9,1009972101657366529
31,Twitter Web Client,"As your governor, I will always fight for the conservative principles and pro-growth economic policies that… https://t.co/O6iMyujAtd",,False,Sat Jun 02 20:55:07 +0000 2018,11,1003017186196230150
91,Twitter Web Client,I'm proud that South Carolina is a leading state in the country for manufacturing. The team we have in place is uns… https://t.co/NGQMiXLv9R,,False,Thu Sep 27 18:42:49 +0000 2018,41,1045383272799195136
46,Twitter for iPhone,After Day 1 of the #SCWinning bus tour it is clear: the momentum is with our team! I have enjoyed being back on the… https://t.co/P29LTzTrCI,,False,Fri Jun 22 03:01:41 +0000 2018,14,1009994806578368512
22,Twitter Web Client,"We made a $25 million tax cut for our small businesses, reducing the unemployment tax rate by over 10% from last ye… https://t.co/AlFI1phSk8",,False,Wed Nov 15 19:35:53 +0000 2017,13,930882064764747776
22,Twitter for iPhone,It’s my job to assist business in keeping government out of the way. I’m grateful to the South Carolina Financial S… https://t.co/cWErV74BM2,,False,Tue Mar 06 15:53:12 +0000 2018,7,971051078224695298
19,TweetDeck,"The people of South Carolina have been clear in their support of justice, including the death penalty. We want the… https://t.co/CCIeWbXr65",,False,Mon Nov 20 22:36:30 +0000 2017,9,932739457152966657
12,TweetDeck,"Individuals and families should plan to board pets with veterinarians, kennels, or other facilities in non-vulnerab… https://t.co/eeJ61nfgqp",henrymcmaster,False,Tue Sep 11 15:50:24 +0000 2018,7,1039541676677779458
11,TweetDeck,"Video: Governor McMaster, State Officials Give Tropical Storm Florence Update September 15 https://t.co/74hsm8BHD1",,False,Sat Sep 15 20:43:14 +0000 2018,1,1041064925077164032
23,TweetDeck,"The mandatory evacuation executive order remains in effect for all zones in Horry, Georgetown, Charleston, Berkeley… https://t.co/FXVAqRhQ1w",henrymcmaster,False,Tue Sep 11 15:48:46 +0000 2018,21,1039541268668403713
23,Twitter Web Client,"Those jobs, and the low unemployment rate that comes with them, mean more opportunities for South Carolinians, bigg… https://t.co/kHJUf4SS6c",henrymcmaster,False,Fri Jun 15 18:23:10 +0000 2018,8,1007689989616877568
45,Twitter for iPhone,Ended Day 2 of our #SCWinning bus tour with a huge rally in Horry County! Thanks to everyone who came out! https://t.co/i6hSM1GQPB,,False,Fri Nov 02 02:02:02 +0000 2018,14,1058177381616238594
56,TweetDeck,President Trump has done an outstanding job delivering results for the American people. I was proud to be one of th… https://t.co/p8Ic8auXPP,,False,Thu Apr 19 16:32:08 +0000 2018,12,987005939382390784
18,TweetDeck,@realDonaldTrump We were proud to be represented at the White House today by @SCDOADAS Director Sara Goldsby and ar… https://t.co/0T58Ujo9Vz,henrymcmaster,False,Wed Oct 24 20:35:24 +0000 2018,1,1055196077266255873
150,Twitter Web Client,"I joined @seanhannity last night to talk about the hypocrisy of the Left. Here in South Carolina, we don't stand fo… https://t.co/ODNXiPEBK8",,False,Sat Jun 02 15:44:25 +0000 2018,32,1002938998153768960
157,Twitter for iPhone,"As you and your loved ones gather at church and other houses of worship today, we ask that you pray for those affec… https://t.co/656qwATej9",,False,Sun Feb 04 15:28:48 +0000 2018,51,960173299568402432
6,Twitter Web Client,Watch LIVE as Governor Henry McMaster delivers the 2018 State of the State Address HERE: https://t.co/bIF5J1vaxk,,False,Wed Jan 24 23:59:47 +0000 2018,6,956315628368945152
32,Twitter for iPhone,"Congratulations to all of the graduates of North Greenville University, and thank you for the honor of being your c… https://t.co/BVkEJRXEM1",,False,Mon Dec 11 17:10:01 +0000 2017,9,940267440956760064
20,TweetDeck,"...and in the strongest possible terms, I urge the Senate to do the right thing and make sure no South Carolinian p… https://t.co/XsyRx6ak0L",henrymcmaster,False,Wed Apr 25 19:25:26 +0000 2018,10,989223878705721344
17,Twitter for iPhone,This order will also allow the department to expedite important security measures following the unprecedented and p… https://t.co/AWSB3geEv9,henrymcmaster,False,Mon Apr 23 19:33:22 +0000 2018,3,988501102369878020
14,TweetDeck,"We are confident that if there is a group capable of combating this problem, providing treatment for those affected… https://t.co/5ungNemLE2",,False,Mon Dec 18 17:52:10 +0000 2017,7,942814760600526848
57,Twitter Web Client,Today we celebrate the historic opening of the U.S. Embassy in Jerusalem and underscore our nation's commitment to… https://t.co/BnEAPtlqId,,False,Mon May 14 19:29:22 +0000 2018,9,996110239207325696
196,Twitter for iPhone,I just voted — have you? President Trump wants YOU to go vote TODAY for our winning team! https://t.co/3VrPVo6md1,,False,Tue Jun 26 14:44:38 +0000 2018,60,1011621260474843137
