favorite_count,source,text,in_reply_to_screen_name,is_retweet,created_at,retweet_count,id_str
94,Gain App,"The MI Opportunity Scholarship would offer two years of debt-free education or training, giving our growing workfor… https://t.co/LV1Gerx5mG",,False,Tue Jun 12 01:50:01 +0000 2018,36,1006352892842921986
35,Gain App,#TeamWhitmer keeps growing and growing. Proud to have the support of @TheIronworkers Local 25 #MiPol #MIGov https://t.co/eiFH7Vmkkv,,False,Tue Nov 14 19:40:50 +0000 2017,12,930520922708160513
33,Gain App,When we show up for one another's fights we win. Our collective action secured a better bill for our first responde… https://t.co/u6kqPh6scI,,False,Thu Dec 07 23:35:23 +0000 2017,13,938914869298057216
82,Twitter for iPhone,Proud to be here standing with Michigan workers to protect our rights to a fair wage #MichiganPrevails https://t.co/5bFHMhUSag,,False,Wed Jan 10 14:05:45 +0000 2018,22,951092701843337216
37,Gain App,Holiday party season is upon us! Thank you to the Southwestern Wayne Dems for a great event this past weekend. https://t.co/kYpuLyYtwS,,False,Tue Dec 05 02:40:12 +0000 2017,3,937874217449742336
49,Twitter for iPhone,I’m ready to go. Let’s set the agenda here in Michigan together,,False,Sat Jan 13 17:46:29 +0000 2018,8,952235414429020160
121,Twitter for iPhone,Great start to the day with a breakfast with @KentDems! https://t.co/XCu9gtQSU1,,False,Sun Sep 30 18:11:02 +0000 2018,30,1046462438332346371
99,Twitter for iPhone,Always excited to spend time with Detroit educators! Thanks to DFT and @aftmichigan for everything you do for our s… https://t.co/DYzSm9SKIL,,False,Thu Sep 13 21:29:26 +0000 2018,23,1040351774664744961
94,Twitter for iPhone,We got four days to do more work. Four days to keep our foot on the gas. The real work happens on the doors. On the… https://t.co/GKXPxKJ8NC,,False,Fri Nov 02 23:36:51 +0000 2018,31,1058503231293349891
205,Twitter Web Client,2018 was one of the hottest years on record. It's time for us to grow our renewable energy portfolio and reduce emi… https://t.co/JX3RkDYmgW,,False,Thu Oct 25 00:16:16 +0000 2018,66,1055251662321913859
499,Twitter Web Client,"Whether you’re one of the millions of Michiganders with a preexisting condition or one of the 680,000 we helped cov… https://t.co/cC4kXMWGCH",,False,Wed Sep 26 20:13:30 +0000 2018,120,1045043706942943232
112,Twitter Web Client,We need government to work for people again. #MIGovDebate,,False,Thu Oct 25 00:42:17 +0000 2018,26,1055258208460255232
36,Gain App,"Join us on Sunday from 12:30pm to 2:30pm for a community picnic at Palmer Park in Detroit!

Free food, music, games… https://t.co/1TuKzdEwIE",,False,Tue Jun 26 19:35:52 +0000 2018,14,1011694551772356608
119,Twitter for iPhone,"“It’s time to start making the education of our children a top priority. Everyone says it, it’s time we actually ge… https://t.co/fP71qenvBr",,False,Tue Nov 28 00:52:29 +0000 2017,37,935310392158547968
46,Gain App,"#WhitmerIsComing to Kalamazoo and Mattawan on Friday! If you're in the area, join us! https://t.co/PB3bLxNk45",,False,Thu Mar 22 14:15:12 +0000 2018,15,976824617624096768
299,Twitter for iPhone,"Pro tip: When the great @SenCarlLevin offers you campaign pointers, listen up https://t.co/pyTL1BLUE6",,False,Mon Jul 16 02:01:24 +0000 2018,35,1018676947298242562
102,Twitter for iPhone,"“Parents and families across the state are counting on us to clean up our environment, and we’re going to get start… https://t.co/siF7dA9NxU",,False,Thu Aug 23 15:11:11 +0000 2018,35,1032646437698453505
322,Twitter for iPhone,"I’m thinking of starting up a band called “Whitmer and the Democrats."" 🤣 Who’s in?",,False,Fri Jun 29 01:08:44 +0000 2018,30,1012503096826781697
89,Gain App,"We've got the momentum and we show no signs of slowing down! #WeGoToWork @eclectablog

https://t.co/anqiTTyfoo",,False,Tue Jul 24 19:10:16 +0000 2018,29,1021834969340096512
298,Gain App,"I knew the 80’s would be back to haunt me 🤦🏻‍♀️! 

https://t.co/widylLdFrw https://t.co/KD4PGRBikD",,False,Fri May 25 00:50:33 +0000 2018,22,999814946811719681
105,Gain App,We must treat our educators with the respect they deserve so they can prepare our kids to succeed. It's time to ret… https://t.co/oKtPOJQgM8,,False,Thu Nov 09 18:39:36 +0000 2017,29,928693570948751361
58,Gain App,"I was proud to stand with the IBEW in the fight to protect prevailing wage, and it is an honor to have the support… https://t.co/AKQOb5PRWp",,False,Tue Feb 13 21:25:46 +0000 2018,19,963524626176409601
93,Twitter for iPhone,🤦🏻‍♀️ Hope you’re okay! https://t.co/KUJFkQWXl6,,False,Sun Jul 08 16:08:54 +0000 2018,13,1015991122877976578
40,Twitter for iPhone,"Thank you to the @aftmichigan members, timekeepers, moderators, and organizers for hosting this important discussio… https://t.co/8KhtT3dcDS",,False,Sat Jan 13 19:27:49 +0000 2018,9,952260915960975360
89,Twitter for iPhone,"At MDP Labor Caucus — “When Republicans locked us out to pass RTW, I didn’t just stand outside with my brothers and… https://t.co/UeX9JVG7I9",,False,Sun Apr 15 15:16:04 +0000 2018,31,985537244219035648
34,Twitter Web Client,Michigan used to have the finest education system in the country. But right now we're failing our kids. We need to… https://t.co/upwMRoile3,,False,Fri Jul 20 00:23:57 +0000 2018,18,1020101971863318528
823,Gain App,"✔ Potholes aren't partisan
✔ Clean water isn't partisan
✔ A good education isn't partisan

Don't you think it's tim… https://t.co/4UkpakdeaK",,False,Sat Aug 11 18:35:17 +0000 2018,259,1028349148591005696
117,Gain App,"We're working hard because it's time for the people of Michigan to set the agenda.

Are you ready to win in 2018?… https://t.co/wIN9EiUS5A",,False,Mon May 14 22:51:20 +0000 2018,38,996161066420920320
283,Gain App,"1 day until polls open. Let's get it done, Michigan. #WinWithWhitmer &gt;&gt; https://t.co/tE0BsQJkre https://t.co/2xyDwzhfPG",,False,Mon Aug 06 13:05:46 +0000 2018,135,1026454285817729025
3889,Twitter for iPhone,"Trust me, we’re on it. https://t.co/KNX79DPci8",,False,Tue Sep 25 23:23:25 +0000 2018,595,1044729112286449664
33,Twitter Web Client,Join us live in Flint at our Community Town Hall: https://t.co/GqZrlogvTz,,False,Mon Sep 24 19:52:58 +0000 2018,11,1044313765116874753
401,Twitter for iPhone,"This is Susan, one of our super volunteers. She’s been with us since the beginning, and now she’s on the bus with u… https://t.co/NkeZGodaNe",,False,Fri Nov 02 21:20:40 +0000 2018,55,1058468961573134336
0,Twitter for iPhone,@katedietrich @philipskaggs Thanks for your support. You can request one here https://t.co/Ggusegm50e,katedietrich,False,Fri Jul 13 23:54:11 +0000 2018,0,1017920154699739137
36,Gain App,"On #WorldAidsDay, let us remember those we lost and ensure we remain committed to ending infections, reducing stigm… https://t.co/fa4ofOMoCi",,False,Fri Dec 01 23:15:48 +0000 2017,11,936735614929600517
216,Gain App,"Thank you for your support, @SenSanders! https://t.co/jYu5XIH6eQ",,False,Sun Nov 04 15:00:25 +0000 2018,26,1059098042236915712
89,Gain App,"""Whitmer recently released a comprehensive plan to fix the roads. She's talking specifics on minimum wage -- $15 an… https://t.co/hEJVarRahQ",,False,Tue Jul 10 14:18:01 +0000 2018,30,1016687993556553728
88,Gain App,Jeff Sessions' latest move takes us backwards in our fight to level the playing field. This underscores the need fo… https://t.co/hMk1b1EvTf,,False,Thu Jan 04 23:15:42 +0000 2018,21,949056773750689792
22,Gain App,Great to be with @UAW Local 163 retirees today. Special thanks to Roy for welcoming me with his handmade Team Whitm… https://t.co/If2p2CZrWK,,False,Fri Nov 17 21:00:13 +0000 2017,7,931628061367455750
298,Twitter for iPhone,I had an unforgettable day traveling the state with @Alyssa_Milano! Thank you for coming to Michigan and helping us… https://t.co/ZLXFy11xYg,,False,Sun Nov 04 15:55:25 +0000 2018,63,1059111886619328520
54,Twitter Web Client,"Hi @joncprevo! You can pick one up in one of our field offices, or contact us at volunteer@gretchenwhitmer.com and… https://t.co/Z7eWEm4SwG",,False,Tue Jul 17 23:46:09 +0000 2018,12,1019367684725727237
196,Gain App,"If we want to restore public trust in our government, we must start by ensuring citizens have the right to obtain r… https://t.co/7MtmPDWVvg",,False,Sun Mar 18 00:35:04 +0000 2018,90,975168672867274753
199,Twitter for iPhone,"The most important work is the work you’re doing to get out the vote. 

Let’s get it done! https://t.co/2VzbAvbcW0",,False,Tue Nov 06 17:49:16 +0000 2018,41,1059865314329006081
59,Gain App,"Join #TeamWhitmer this summer and let's build the Michigan we all deserve! ​#WeGoToWork

➡➡➡ https://t.co/pVGebp5MXa https://t.co/h81kTuxvas",,False,Mon Apr 23 02:20:29 +0000 2018,24,988241166310223874
441,Twitter for iPhone,"Thank you, Lansing! Let’s do this! https://t.co/oP68hyJM0C",,False,Tue Nov 06 01:54:38 +0000 2018,53,1059625069603897344
50,Gain App,"In May, I had the chance to speak with Michiganders in Oscoda who were concerned about why our leaders have done so… https://t.co/i87VmyNIyy",,False,Tue Jul 10 17:20:08 +0000 2018,29,1016733823009280001
532,Tweetbot for Mac,It is time to go. https://t.co/k2hBGXCw7N,,False,Wed Sep 12 01:52:49 +0000 2018,129,1039693282241077249
31,Twitter for iPhone,It's #ElectionDay in Michigan! Make a plan to vote and find your polling place here: https://t.co/EWMB1E64Z4,,False,Tue Nov 07 16:59:10 +0000 2017,7,927943521851633664
67,Gain App,"Working people are the backbone of Michigan, and that’s why I’m so proud to have the support of so many hardworking… https://t.co/KMFs5BxgZt",,False,Sun Nov 04 22:00:43 +0000 2018,21,1059203817395372034
352,Twitter for iPhone,"""She went desk to desk lining up the votes. And because of her efforts, 680,000 people in Michigan now have health… https://t.co/pESok1IGYG",,False,Sun Aug 05 19:16:32 +0000 2018,147,1026185201611890688
105,Gain App,“Gretchen Whitmer is the clear choice for Michiganders and the champion we need to move equality forward in the Gre… https://t.co/i5HyNGrtrb,,False,Fri Nov 02 19:00:40 +0000 2018,50,1058433728249319424
37,Gain App,"Energized by the #MIDemDebate?

Sign up to volunteer!

https://t.co/xoGRV0PAvC",,False,Thu Jun 21 04:46:36 +0000 2018,16,1009658821462118402
81,Twitter for iPhone,Excited to be here in Dingell Country at the House that Labor built with the 12th Congressional Democrats! https://t.co/zfULSk7No4,,False,Sun Dec 17 23:30:58 +0000 2017,8,942537637642022912
61,Gain App,"This week marks the start of Ramadan. Ramadan Mubarak to everyone observing across Michigan!

https://t.co/AkW2wzkBK1",,False,Wed May 16 00:25:35 +0000 2018,25,996547174103121921
587,Gain App,Clean drinking water is a right. As governor I'll create the Department of Great Lakes and Freshwater so that no on… https://t.co/Z1IukSsNC4,,False,Sun Oct 14 19:47:19 +0000 2018,219,1051560099062456323
50,Gain App,Proud to be supported by the Michigan Pipe Trades Association! I'm ready to fight for Michigan workers and families. https://t.co/h02uvno4Kg,,False,Fri Nov 02 17:00:24 +0000 2018,17,1058403462835326977
20,TweetDeck,"We’ve accomplished so much since starting our campaign. Our Urban Agenda listening tour brought us to Detroit, Pont… https://t.co/YZMHYnPcvV",GovWhitmer,False,Wed Jan 03 21:37:33 +0000 2018,6,948669687579205633
194,Twitter for iPhone,“We’ve got to elect a governor who is more beholden to our children than Betsy DeVos. A governor who has the backbo… https://t.co/sxSSjNDPTm,,False,Mon Jul 02 22:59:33 +0000 2018,41,1013920140939931649
100,Twitter for iPhone,“Michiganders deserve a governor who works just as hard as they do” #econclub https://t.co/KfTMW22L5b,,False,Wed Oct 31 16:26:13 +0000 2018,30,1057670086436237312
64,Twitter for iPhone,"Stopped by the Dearborn #ONEcampaignMI office with @DebDingell, @sbagen, and Tiffany Tilley. This office has the mo… https://t.co/tQmZ3YJcW8",,False,Wed Oct 31 19:02:33 +0000 2018,29,1057709428902952961
683,Twitter for iPhone,"Out here rallying with our amazing elected officials, candidates and one of America’s favorites @JoeBiden! Time to… https://t.co/nkVZVYcQQE",,False,Thu Nov 01 23:07:15 +0000 2018,156,1058133397414076417
1,Twitter for iPhone,@james_backwardz Thanks so much for your support! Here ya go: https://t.co/Ggusegm50e,james_backwardz,False,Sun Jul 22 22:07:56 +0000 2018,0,1021154908458881024
76,Twitter for iPhone,Great coffee hour in Vassar today. As I get across the state I hear the same things — people want access to good pa… https://t.co/frxUhx7mZ6,,False,Sun Feb 25 20:15:49 +0000 2018,14,967855677052997633
111,Twitter Web Client,"$750 million is taken away from our kids' education every single year. 

We need a governor with a backbone of tita… https://t.co/uxjGL3x3Au",,False,Thu Jun 14 15:33:59 +0000 2018,41,1007285025488896001
175,Gain App,Packed house tonight in West Bloomfield! More and more people are showing up because they are ready for a governor… https://t.co/C0y4A9UxAT,,False,Wed May 16 00:35:39 +0000 2018,39,996549704891674624
410,Gain App,If we want to attract the best talent in Michigan it's time we give teachers the respect they deserve and more supp… https://t.co/fR6Mc0i06E,,False,Mon Jan 08 01:35:27 +0000 2018,124,950179108851417093
224,Gain App,"The only word I can find right now is HEROES. It's not easy telling your story, I know. We must uplift these courag… https://t.co/DEICevxFx0",,False,Wed Jan 24 18:21:52 +0000 2018,50,956230585990746112
352,Twitter Web Client,I believe that it is time for Michigan to get on the right side of history. It's time to amend the Elliott-Larsen C… https://t.co/TQhcTOe3xb,,False,Thu Oct 25 00:45:28 +0000 2018,107,1055259011266818048
191,Gain App,I am so inspired by the young people standing up and speaking out. To the Kalamazoo students that spoke at yesterda… https://t.co/ZjPQ0mQQCG,,False,Fri Feb 23 22:40:49 +0000 2018,26,967167388675379200
70,Twitter for iPhone,"Thank you for your vote, @CurtisHertelJr! https://t.co/eVH18PvAHM",,False,Tue Aug 07 13:33:26 +0000 2018,19,1026823632948015104
29,Twitter for iPhone,Great crowd here tonight in Battle Creek with the @CalhounDems ! https://t.co/s9eShBh6Yl,,False,Thu Nov 16 00:24:40 +0000 2017,6,930954736039350272
93,Twitter Web Client,"If we're going to get people to work in high wage jobs, then we need to get serious about fixing infrastructure and… https://t.co/eiA2rHIPit",,False,Thu Oct 25 00:32:01 +0000 2018,28,1055255626018942977
9,Twitter Web Client,"@BernieSanders is on stage NOW!

Tune in: https://t.co/FFnmo8MYiW",BernieSanders,False,Sat Oct 20 01:13:08 +0000 2018,3,1053454035389464579
597,Twitter Web Client,"“I worked across the aisle with Sen. Whitmer when she was putting the votes together to pass Medicaid expansion, an… https://t.co/kKh8pGUR9x",,False,Thu Sep 20 11:53:58 +0000 2018,220,1042743669563043841
188,Gain App,This past week I stood with students at the #MarchforOurLives in Lansing. I am no stranger to tough fights and this… https://t.co/ia2HWXyTcU,,False,Tue Mar 27 20:55:45 +0000 2018,42,978737359956119552
2460,Twitter for iPhone,Who did this? 😂😂😂 https://t.co/TVpRyNPocu,,False,Fri Sep 14 22:07:28 +0000 2018,427,1040723733030350848
41,Twitter for iPhone,"Tonight, our Michigan grit and ingenuity is on display at #NAIAS. The Auto industry is a proud part of Michigan’s h… https://t.co/lqSqJp29iS",,False,Sat Jan 20 02:49:41 +0000 2018,14,954546442328330245
92,Twitter Web Client,In #Detroit today with @mayormikeduggan touring businesses and meeting members of the community! https://t.co/W7kAA71HXG,,False,Tue Jun 05 21:11:08 +0000 2018,14,1004108380812857345
23,Twitter for iPhone,"Thank you everyone who showed up to knock doors here in Saginaw! We couldn’t do this without you! #WeGoToWork

Sign… https://t.co/RNx8dEaaXr",,False,Sun Jul 08 19:06:46 +0000 2018,4,1016035885035421696
392,Twitter for iPhone,Michigan is dead last in the nation when it comes to government transparency. Don't you think it's time that we hol… https://t.co/KhRPVkmjcU,,False,Sat Sep 01 17:46:00 +0000 2018,142,1035946890150457344
306,Twitter for iPhone,We’re going to keep our foot on the gas until the job is done. #GetOutTheDamnVote https://t.co/F9GTlRBTGl,,False,Tue Nov 06 19:39:19 +0000 2018,57,1059893008416555008
76,Gain App,“This year’s election is so important for our union and public sector workers across the state. Gretchen has stood… https://t.co/XPYC0YzIsg,,False,Thu Nov 01 14:00:55 +0000 2018,41,1057995906174332929
121,Twitter for iPhone,Fueling up with a hot cup of coffee from Narrow Way on Livernois! https://t.co/61cDNPlPWW,,False,Sat Oct 06 14:58:51 +0000 2018,18,1048588400029315073
27,Twitter Web Client,We're LIVE on Facebook with @MSUDems! Tune in here: https://t.co/2MLLVAOKsq #WinWithWhitmer,,False,Tue Sep 18 23:32:23 +0000 2018,3,1042194654161235969
240,Twitter Web Client,"Had a blast on Sunday at Motor City Pride!  🌈

We need to show up for one another's fights because everyone is impo… https://t.co/ND1axEPnRP",,False,Tue Jun 12 20:09:33 +0000 2018,52,1006629601270001664
162,Gain App,"We need your help if we're going to throw @SchuetteonDuty a great big retirement party in November.

Check out… https://t.co/8eMRZ5Zp8I",,False,Mon Aug 13 20:10:26 +0000 2018,55,1029097869591146497
396,Twitter for iPhone,“I’m grateful for the men and women of labor in this state. We built the middle class. We’re going to make this a s… https://t.co/dQLr5ThOky,,False,Mon Sep 03 20:35:41 +0000 2018,96,1036714371295207425
126,Twitter for iPhone,Made a surprise visit to Fountain of Truth Church with Bishop Jones! https://t.co/UgHfTG1ill,,False,Sun Aug 05 17:33:57 +0000 2018,22,1026159385041686529
131,Gain App,It's time we had a governor who will focus on getting things done that will actually make a difference in people's… https://t.co/N5bzi1eNyM,,False,Sun May 13 01:55:26 +0000 2018,34,995482618954240000
149,Gain App,"“Gretchen Whitmer is the best choice for UAW members and their families, because she understands that every UAW job… https://t.co/HS39DU2Zyk",,False,Tue Oct 30 14:00:41 +0000 2018,61,1057271072268140546
566,Twitter for iPhone,"Are you energized by tonight’s debate? I know I am!

We have 25 days left until November 6th. Sign up to volunteer… https://t.co/QEeJBSxxOc",,False,Sat Oct 13 00:46:03 +0000 2018,144,1050910501830619136
160,Twitter for iPhone,We were all devastated when the governor stopped bottled water for Flint. We’re not gonna stop until every lead pip… https://t.co/Z5brleLygG,,False,Sat Apr 28 18:24:20 +0000 2018,64,990295665698902016
87,Twitter for iPhone,“Look around. This right here is what democracy looks like” - @Alyssa_Milano https://t.co/HlqHngQpMj,,False,Sat Nov 03 16:19:48 +0000 2018,27,1058755634814951425
27,Twitter for iPhone,We’re LIVE in Kalamazoo with @jonhoadley and @SeanAMcCann! Watch here: https://t.co/hKMHmbaHnU,,False,Sat Aug 04 19:44:07 +0000 2018,9,1025829757223677958
339,Gain App,"Every day I meet someone on the campaign trail who reminds me what all of this is about.

Thank you Bridget and Cor… https://t.co/RTB0ngLiYP",,False,Sun Aug 12 13:58:13 +0000 2018,98,1028641809893937152
172,Twitter for iPhone,"CLEAN DRINKING WATER is on this ballot.

GREAT PUBLIC SCHOOLS are on this ballot.

And THE DAMN ROADS are on this b… https://t.co/aPqpRLvLvl",,False,Sat Nov 03 23:32:31 +0000 2018,59,1058864531882033153
137,TweetDeck,"“We’re making huge investments in education.” - @onetoughnerd

What he means: 
- cut school aid fund to pay for $2B… https://t.co/xG2CrbBCRX",,False,Wed Jan 24 00:52:09 +0000 2018,73,955966417593143296
314,Gain App,Michigan needs a governor who will stand up for women’s rights. It’s disgusting that @SchuetteonDuty wants to take… https://t.co/UL2tnO0RrX,,False,Tue Jul 24 18:10:12 +0000 2018,102,1021819854762987520
71,Twitter Web Client,Our young people need to know about all opportunities available to them to make a living and that must include the… https://t.co/MjYVXQ8EnE,,False,Wed Mar 28 23:55:06 +0000 2018,21,979144882055868416
64,Twitter Web Client,We are going to build a coalition that addresses the talent gap. I'm going to work with anyone who wants to make su… https://t.co/U2bdFtPWxW,,False,Thu Oct 25 00:39:48 +0000 2018,23,1055257583206965248
183,Twitter for iPhone,The last #MIGovDebate is coming up in under an hour! Watch it on @Local4News or catch it online at… https://t.co/iaYo43hEsf,,False,Wed Oct 24 23:12:37 +0000 2018,72,1055235644987969537
92,Twitter for iPhone,“What we need now more that ever in Michigan is schools that prepare our kids and jobs that support our families.”,,False,Sun Nov 19 19:22:12 +0000 2017,19,932328171734753283
113,Gain App,"When it comes to what's best to make our schools safe, our leaders should listen to the educators who work with our… https://t.co/wXRWJVpIlE",,False,Wed May 16 01:03:37 +0000 2018,37,996556744057872384
378,Twitter Web Client,Thank you @EricHolder for your support! #LetsGetItDone https://t.co/yhgB7xLmhI,,False,Thu Oct 11 15:08:51 +0000 2018,100,1050402859009929216
90,Gain App,Big News #WhitmerIsComing to Detroit! We're moving our campaign HQ to Northwest Detroit and I hope you can join us… https://t.co/1YxtQ0aUYY,,False,Tue Feb 27 00:40:24 +0000 2018,30,968284647900762114
183,Gain App,"Kids in Detroit, kids in Flint, and kids in every part of MI deserve better. Failing to address the threat lead poi… https://t.co/6tADJhuAym",,False,Sun Nov 19 01:15:56 +0000 2017,145,932054801558491136
206,Gain App,"People used to move to Michigan for opportunity because they knew they could make a darn good living. But today, to… https://t.co/gk9XH81ng7",,False,Tue Aug 14 20:50:42 +0000 2018,83,1029470389234294784
462,Twitter for iPhone,Found the Koch Brothers’ moving truck in Lansing today. Here’s an idea... https://t.co/kG00gl81Tl,,False,Thu Oct 18 17:53:57 +0000 2018,120,1052981121141678081
156,Gain App,"Happy #OberonDay! Last week, I toured @BellsBrewery in Comstock to see how they make this great Michigan beer and l… https://t.co/HKTZnTnnWH",,False,Mon Mar 26 23:14:31 +0000 2018,24,978409896487112705
322,Twitter for iPhone,It's ridiculous that Washington has chosen to shut down the government to avoid passing legislation to #ExtendCHIP… https://t.co/ozSFUPqlY8,,False,Sat Jan 20 05:36:09 +0000 2018,103,954588334717849600
140,Gain App,Michigan's educators spend every day preparing our kids for success. Why doesn't our government treat them with the… https://t.co/Qgky3oZcIv,,False,Thu Dec 28 01:40:52 +0000 2017,50,946194204971229185
100,Twitter Web Client,"We need a governor who's going to get things done for Michigan students.

Read my plan: https://t.co/9YpcPungHK",,False,Fri Jun 08 17:02:48 +0000 2018,40,1005133051008114689
809,Twitter for iPhone,There are Michiganders who work multiple jobs and still struggle to make ends meet. No one who works full time shou… https://t.co/6iR5gEkb4w,,False,Sat Sep 29 17:25:27 +0000 2018,218,1046088581423534081
100,Twitter for iPhone,"It’s time for us to set the agenda in this state. Every one of us must be part of this, because this election is ab… https://t.co/LyFqS1T0r3",,False,Mon Aug 27 22:36:21 +0000 2018,24,1034208019293163520
71,TweetDeck,And we're off! I'm so excited to be participating in the #MIDemDebate gubernatorial debate. Watch the debate here: https://t.co/HwECnHVAd9,,False,Wed Jun 20 23:02:24 +0000 2018,14,1009572202289729536
34,Gain App,"Urge Congress to pass a clean #DreamActNow for the 800,000 DREAMers who grow our economy, educate our children, and… https://t.co/bblTZ7IUuo",,False,Fri Dec 08 22:30:54 +0000 2017,10,939261030240280577
162,Twitter for iPhone,Max is fired up at @MichiganDems #mdpconvention https://t.co/tCe86nS1AL,,False,Sat Aug 25 13:00:01 +0000 2018,18,1033338205054140416
75,Twitter for iPhone,Another packed house! Great to be here in Newaygo County discussing the issues that matter most to Michiganders. https://t.co/Mmo5ajDnqG,,False,Sun Apr 08 15:32:54 +0000 2018,16,983004765511667712
89,Gain App,"I'm so proud to have the support and friendship of State Representative Sherry Gay-Dagnogo. Together, we will alway… https://t.co/Kggek9Bo8L",,False,Sat Jun 16 20:00:40 +0000 2018,27,1008076917344473089
2154,Twitter Web Client,I'm so honored to have the support of @BarackObama! https://t.co/bKSfJg1xf1,,False,Mon Oct 01 16:51:28 +0000 2018,478,1046804801789579265
23,Twitter for iPhone,Happy #MFGDay18! Thank you #Paslin for taking @MarkHackel and me on a tour of your headquarters and for helping edu… https://t.co/HcvNFyX7co,,False,Fri Oct 05 16:11:26 +0000 2018,13,1048244278378594305
21,TweetDeck,"We’ve got 10 months until Election Day, and I hope you’ll get involved today -- visit https://t.co/S5o3g2mlZ5. https://t.co/Doth6QHSHP",GovWhitmer,False,Wed Jan 03 22:14:25 +0000 2018,15,948678966558289920
6,Twitter Web Client,Step 1 is to declare a State of Emergency,GovWhitmer,False,Mon Nov 20 15:27:47 +0000 2017,0,932631565691162625
170,Gain App,Michigan deserves a governor who will stand up for our values https://t.co/e4m0Mf4WLh,,False,Sat Aug 04 20:05:54 +0000 2018,46,1025835239044730886
90,Twitter for iPhone,“The people in our state deserve a governor who works just as hard as they do. A governor who never forgets that th… https://t.co/GepK0U9Vw2,,False,Sat Jun 23 15:52:31 +0000 2018,22,1010551182102802434
56,Gain App,Join my friend @GovInslee and the @SierraClub for a day of action in Ann Arbor this Sunday. Governor Inslee knows w… https://t.co/zA8XHxbXAB,,False,Thu Oct 25 17:57:09 +0000 2018,28,1055518642446581760
598,Gain App,I believe in a Michigan where everyone has the opportunity to get ahead. The MI Opportunity Scholarship will provid… https://t.co/oxkcwECoMR,,False,Thu Oct 25 18:30:37 +0000 2018,149,1055527066094002176
