favorite_count,source,text,in_reply_to_screen_name,is_retweet,created_at,retweet_count,id_str
6,Twitter Web Client,I’ll use my experience to make Oklahoma’s budget more accountable and to audit every agency while casting a bold vi… https://t.co/zaJcEIHcP1,,False,Thu Apr 12 17:35:09 +0000 2018,3,984485084941242368
13,TweetDeck,Catching up on chores with the kids this afternoon! How are you enjoying the beautiful #okwx today? #OKfamilyfarm https://t.co/mDxBlQ6IsQ,,False,Sun May 20 22:40:22 +0000 2018,2,998332634131582976
4,Tweetbot for Mac,Listen in to tonight's #okgov debate on @KOKCradio at 6PM! You can tune-in on 1520AM or at https://t.co/lya9vZQQob.… https://t.co/aU9XknyORa,,False,Mon Apr 09 21:41:26 +0000 2018,2,983459900876574725
9,TweetDeck,"I believe we must do the same to achieve a brighter future for Oklahoma, which is why I am running as a conservativ… https://t.co/GQyVPfEM4O",,False,Sun Nov 19 21:22:43 +0000 2017,3,932358501460004867
9,Tweetbot for Mac,"Happy #ValentinesDay to my wife Sarah. She’s an incredible mother to our six children, and she is the love of my li… https://t.co/tXzcqkHwr2",,False,Wed Feb 14 14:56:45 +0000 2018,1,963789111847989249
8,Twitter Web Client,"""I support Kevin Stitt for governor because he is determined to fix the budgeting issues and inefficiencies in our… https://t.co/DpYVjEaDyw",,False,Wed May 02 14:24:41 +0000 2018,5,991684908841078784
8,TweetDeck,Thank you Kay County Republican Party for allowing me to come share my vision to make Oklahoma a top 10 state! https://t.co/TSAslZeVDm,,False,Sun Jan 21 22:30:01 +0000 2018,0,955205870555746307
54,Tweetbot for Mac,Want to avoid the long Election Day lines on November 6th? Request an absentee ballot today and make your voice hea… https://t.co/z5xlhMgK73,,False,Wed Sep 26 14:23:46 +0000 2018,26,1044955693407784960
6,Sprout Social,I appreciate the brave Tulsa WWII veterans who retold their personal stories of what it was like after the attack o… https://t.co/oI9dAXC0Do,,False,Thu Dec 07 21:00:05 +0000 2017,1,938875786903343104
14,Twitter for iPhone,My first paid job as a kid was throwing papers for the Norman Transcript! https://t.co/Q4MRiB4uSz,,False,Sat Feb 24 18:35:46 +0000 2018,3,967468110042288130
10,Twitter Web Client,"""I support Kevin Stitt for governor. He stands behind what he says. He supports our kids. He comes from a rural, ro… https://t.co/YA3f694txZ",,False,Fri May 04 15:01:00 +0000 2018,1,992418823738396672
20,Sprout Social,"As we recognize our statehood today, I am celebrating that Oklahomans are resilient, hardworking people. We can bui… https://t.co/mi6TunCPyx",,False,Thu Nov 16 19:03:13 +0000 2017,5,931236229374410758
30,TweetDeck,"What a week! Thank you to all who came to our 14 public events across OK - Enid, Stillwater, Woodward, Shattuck, We… https://t.co/J6tmVj3EKy",,False,Sat Jul 14 22:38:14 +0000 2018,8,1018263429122023425
67,Tweetbot for Mac,EARLY VOTING IS OPEN! Get the details of where you can vote at the provided link. Polls are open today and tomorrow… https://t.co/s3fhejSe9Y,,False,Thu Nov 01 13:11:55 +0000 2018,30,1057983576170524673
5,joe.sentry,"Enjoyed sitting down with @PC1170 at @KFAQ earlier last month to discuss my campaign, and some of the issues I'm pa… https://t.co/qE6zopB2ci",,False,Sat Feb 03 15:15:04 +0000 2018,3,959807456607170560
21,Twitter Web Client,"I can’t imagine life without my beautiful wife Sarah by my side. Since day one, she’s been my rock. Her guidance, l… https://t.co/HtSjcJhVHD",,False,Fri Jun 22 14:24:58 +0000 2018,9,1010166760312590337
10,TweetDeck,"We had a great turn out in Okemah, Stigler, and Wilburton this week! Tomorrow (Monday, Feb. 5), we'll be holding a… https://t.co/jrNVD8qCNc",,False,Sun Feb 04 23:03:11 +0000 2018,1,960287650874822656
57,Twitter for iPhone,It is great to be in the Sooner State. And I’m here for one reason and one reason only: Oklahoma – and America – ne… https://t.co/VP0HerwXqo,,False,Thu Oct 18 22:24:11 +0000 2018,17,1053049128010371073
15,Twitter Web Client,"""I support Kevin Stitt for #okgov bc I see him as a true statesman. He stands on a bedrock of principles, has a str… https://t.co/Gm5vRpmoSc",,False,Wed Jun 13 20:18:49 +0000 2018,4,1006994318048071680
1,Twitter for iPhone,"@RawsenM Great question! I support current laws on this matter, but I’d like to hear your proposal on why we should… https://t.co/OJr8Zw75eP",RawsenM,False,Sun Sep 30 02:09:55 +0000 2018,0,1046220564749332480
7,Twitter Web Client,What a perfect description about my wife’s speech on the campaign trail. Sarah’s heart is for people. She has been… https://t.co/xBOQHOnoZr,GovStitt,False,Mon Jun 11 21:00:31 +0000 2018,1,1006280036620652545
11,Tweetbot for Mac,I’m looking forward to participating in the @okfarmbureau’s #okgov candidate forum in OKC today at 3:30pm. Should b… https://t.co/QjCLvFQgKI,,False,Mon Mar 05 16:15:23 +0000 2018,1,970694269685194754
10,Twitter Web Client,"""I support Kevin Stitt for governor of Oklahoma because I truly believe the Republican party needs to make a way fo… https://t.co/2Ndm0EjTmS",,False,Tue May 08 17:02:54 +0000 2018,5,993899053715992578
29,TweetDeck,Free press is critical to democracy. The five journalists killed yesterday were public servants who worked tireless… https://t.co/LrAwXTWS9v,,False,Fri Jun 29 16:08:20 +0000 2018,3,1012729487597953024
8,joe.sentry,Want to avoid the lines on Election Day? Head to your County Election Board to make your voice heard in the GOP Pri… https://t.co/NWE57ETaaA,,False,Thu Jun 21 13:00:04 +0000 2018,4,1009783008008790017
11,TweetDeck,"After visiting @ron_on_RON this morning, we dropped by the Oklahoma City Stockyards where my granddad was the head… https://t.co/HbrCC1FIHr",,False,Mon Jul 23 20:44:02 +0000 2018,6,1021496180679815168
15,Tweetbot for Mac,What an honor to receive the Development of the Year award last night from @NAIOP. Gateway’s new headquarters and d… https://t.co/s8LAXjZQjK,,False,Fri Apr 20 15:42:46 +0000 2018,0,987355905120440320
16,Tweetbot for Mac,This election is about delivering conservative change and new leadership in Oklahoma! I am excited for all the volu… https://t.co/OXkm1tivRh,,False,Mon Jun 25 20:21:54 +0000 2018,5,1011343749488758786
3,TweetDeck,Thank you to the @tulsarepubclub for giving me the opportunity today to share why I am running as a Republican cand… https://t.co/Krr06sV05z,,False,Sat Jan 20 01:08:12 +0000 2018,1,954520904041746432
16,TweetDeck,We’ve let career bureaucrats run our state government for far too long. I’m ready to bring in new ideas &amp; new Oklah… https://t.co/Ly04SeFrBx,,False,Fri Aug 03 17:26:07 +0000 2018,8,1025432639136821248
7,Twitter for iPhone,"I had the opportunity to attend the @TulsaChamber meeting today. I’m running 4 Gov, bc I have proven leadership exp… https://t.co/44gIcbiw22",,False,Thu Jan 18 20:21:22 +0000 2018,1,954086334699851776
7,Tweetbot for Mac,"I built my business from the ground up, and I know first hard that entrepreneurship takes hard work and a village o… https://t.co/GYgnJ9O8mL",,False,Fri Jan 26 19:24:47 +0000 2018,3,956971196867842048
5,Tweetbot for Mac,"Today, we honor Dr. King and his dream for a better, brighter tomorrow for our nation. He was a leader whose action… https://t.co/GZTMornhLR",,False,Mon Jan 15 14:46:39 +0000 2018,1,952914935163604997
29,Twitter Web Client,"In a Stitt administration, passage of SQ 801 will be the start of ongoing efforts to retain and recruit the best te… https://t.co/O1lHC3SUh4",,False,Tue Sep 25 00:24:53 +0000 2018,14,1044382195979374593
17,joe.sentry,Thank you Tulsa first responders for welcoming us at your Fit First workout on Thursday! FOX 23 came along for the… https://t.co/YILdjIeewE,,False,Fri Aug 24 13:10:05 +0000 2018,3,1032978351017918464
44,joe.sentry,"Thanks for joining the team, Sen. Paxton. Let's get Oklahoma's turnaround started right here, right now! https://t.co/xoYezsEBqX",,False,Sun Aug 26 22:05:06 +0000 2018,11,1033837770282856448
21,Tweetbot for Mac,I appreciate the kind words from a fellow Oklahoman in the Tulsa World’s LTE section. I am committed to recruiting… https://t.co/lD2l6wioRU,,False,Tue Jul 03 21:41:48 +0000 2018,7,1014262958879330304
44,TweetDeck,#GovernorDebate #OKpol https://t.co/0dOuyJ5BIB,,False,Thu Oct 25 00:15:50 +0000 2018,33,1055251554389889024
10,Twitter Web Client,"""Kevin Stitt has learned to work with people from different backgrounds and he has learned how to solve some of the… https://t.co/WzewbRAOmP",,False,Sun May 13 23:04:49 +0000 2018,2,995802071571025925
9,Tweetbot for Mac,Our message is resonating with Oklahomans across the state. The chaos at the State Capitol has been a wakeup call f… https://t.co/T47Cg8VnBO,,False,Thu Feb 01 14:54:37 +0000 2018,3,959077533227634699
72,joe.sentry,"Our victory is rooted in the hard-working Oklahomans of this great state. As we celebrate this Labor Day weekend, w… https://t.co/fE1HgOb6nW",,False,Fri Aug 31 15:30:06 +0000 2018,19,1035550301577723904
8,TweetDeck,"If GOP does not hit reset on its leadership, then we risk creating a discontent, disengaged voter base that, in tur… https://t.co/iX9R1O5nYL",,False,Sun Nov 19 21:24:11 +0000 2017,1,932358867744378882
3,Tweetbot for Mac,"I’m looking forward to tomorrow’s #okgov forum in Enid. If you’re in the area, stop by the Central National Bank Ce… https://t.co/dZw5omHvMq",,False,Tue Feb 20 14:51:12 +0000 2018,0,965962042099359744
53,Twitter Web Client,Tell us why you support Stitt for Gov and win a chance to get a picture with Vice President Pence at Thursday’s ral… https://t.co/oqfMS7zmPS,,False,Tue Oct 16 20:39:00 +0000 2018,26,1052297880910909442
17,Twitter for iPhone,Thank you to all who came to our public meeting in Kingfisher tonight! #Stitt4Gov https://t.co/OWRYmvYmCk,,False,Wed Jul 18 00:30:25 +0000 2018,6,1019378823794712576
23,Twitter for iPhone,"Thank you to all who came to our public meeting in Durant today! It’s going to take all of us, from every corner of… https://t.co/g3Dgp2013t",,False,Sat Aug 04 02:14:02 +0000 2018,9,1025565493191757824
11,Tweetbot for Mac,It’s difficult to put into words how much #BarbaraBush meant to our nation. An incredible First Lady and First Moth… https://t.co/YHdn4oygsj,,False,Wed Apr 18 13:49:26 +0000 2018,0,986602609439072256
18,Twitter for iPhone,What a fantastic evening with fellow Oklahoma Republicans! I enjoyed sharing the stage with &amp; hearing from such str… https://t.co/I69zGC3TFx,,False,Sun Jul 15 01:25:36 +0000 2018,5,1018305546800320513
13,joe.sentry,ICYMI: I encourage you to listen to my recent interview with Ron Hays to learn more about my vision to work with Ok… https://t.co/fM3La10QVj,,False,Tue Jul 31 13:30:05 +0000 2018,5,1024286077123747841
99,joe.sentry,"My opponent, Drew Edmondson, helped lead Hillary Clinton’s presidential effort, and donated big money to her campai… https://t.co/NfA2Iuleo8",,False,Fri Oct 19 14:15:06 +0000 2018,60,1053288432871575552
10,TweetDeck,"I have lived the American Dream, starting my company with just $1,000 &amp; a computer thanks to Republican policies th… https://t.co/QGysSaPwmb",,False,Wed Aug 08 01:28:16 +0000 2018,4,1027003527774830598
2,Twitter Web Client,"At the forum, I was the only candidate who promised to leverage President Trump's tax cuts to grow Oklahoma. I am m… https://t.co/5xPWB5dFfr",GovStitt,False,Tue Apr 24 22:37:56 +0000 2018,0,988909937811230721
12,Tweetbot for Mac,Appreciate @KRMGtulsa for having me on yesterday! Voters showed us on Tuesday that they are ready for a conservativ… https://t.co/5gCQPPMYV3,,False,Thu Jun 28 18:18:18 +0000 2018,4,1012399810144419840
47,TweetDeck,"It’s time for an independent governor who will end politics
 as usual in Oklahoma. I will deliver accountability an… https://t.co/nM6ktp2hBA",,False,Thu Aug 23 00:57:20 +0000 2018,13,1032431562892214273
22,TweetDeck,"We must start by making government accountable and transparent. As we do this, I will be committed to setting our s… https://t.co/0MGoZjZiko",,False,Tue Apr 03 19:48:58 +0000 2018,10,981257267222851587
29,joe.sentry,"Thanks for joining the team, Rep. Humphries. Let's get Oklahoma's turnaround started right here, right now! https://t.co/CPGKLjRd59",,False,Fri Aug 24 19:30:07 +0000 2018,9,1033073991077060608
5,Tweetbot for Mac,"Throughout my #OKlisteningtour, I’ve heard directly from voters about their concerns. Tonight @POTUS will deliver h… https://t.co/Bv6krgUO0u",,False,Tue Jan 30 16:23:55 +0000 2018,0,958375229822263303
10,Tweetbot for Mac,TODAY is the LAST day to register to vote in the Aug. 28th GOP Runoff! Visit your local election board today &amp; sign… https://t.co/hQn9t8Kd7H,,False,Fri Aug 03 14:55:45 +0000 2018,6,1025394796993675264
1,Twitter for iPhone,@Schultz08928330 @JimPolk Quail in Western Oklahoma,Schultz08928330,False,Wed Jun 20 14:02:37 +0000 2018,0,1009436362209144832
3,joe.sentry,"J.Douglas of @k101online asked if I have always been a Republican. My answer is absolutely, and you can listen here… https://t.co/MlMlICEhzi",,False,Thu Jan 18 16:05:03 +0000 2018,1,954021828640600064
1,joe.sentry,"SURVEY: We want to know what you think of our campaign, and of the races that are heating up across Oklahoma. Take… https://t.co/P4ydt7MhYg",,False,Wed Jan 10 14:30:05 +0000 2018,0,951098826403844096
12,TweetDeck,"Another awesome meet and greet in OKC! I am committed to being the governor for all 4 million Oklahomans, and we ar… https://t.co/boPcSQRInZ",,False,Sun Feb 18 21:11:51 +0000 2018,5,965333062484742145
11,TweetDeck,Oklahomans have a strong entrepreneurial spirit! This is an awesome piece by @NewsOK about @JillCastilla’s new… https://t.co/muGdtxkUUO,,False,Tue Jan 02 22:41:10 +0000 2018,3,948323307643981826
88,Tweetbot for Mac,"Since day 1, I’ve been committed to a vision that will deliver a Top Ten #Oklaed. I’ve hosted community meetings &amp; … https://t.co/GrSks9Tt3H",,False,Mon Oct 08 14:02:55 +0000 2018,39,1049299103077814272
8,Sprout Social,"Whether you are neck deep in #BlackFriday madness or #SmallBusinessSaturday, consider shopping local OK businesses… https://t.co/ivfKE5M2xi",,False,Fri Nov 24 19:42:02 +0000 2017,2,934145103656046592
0,Tweetbot for Mac,Join us THIS SATURDAY for our 2nd Day of Action volunteer event! We’ll be knocking doors and sharing our message di… https://t.co/fCjPVQstI3,,False,Mon Apr 09 14:18:40 +0000 2018,0,983348475004882944
30,Twitter for iPhone,"The sun came out just in time for our meet and greet in Cushing, Oklahoma! Thankful for all who showed up for our d… https://t.co/7enjvF9cJk",,False,Fri Aug 17 00:21:57 +0000 2018,7,1030248331468070912
43,Twitter Web Client,"If we want to recruit great teachers, we have to pay competitive salaries, and if we want to attract and retain job… https://t.co/CiZVFqqkhY",,False,Mon Sep 24 23:34:13 +0000 2018,19,1044369444649267200
0,TweetDeck,"""'It was a pretty no-holds-barred conversation. I was pretty clear with him that the agency was on the verge of fin… https://t.co/bdwte4OxT6",GovStitt,False,Mon Apr 16 19:40:08 +0000 2018,0,985966089409564674
22,Twitter Web Client,"""I truly believe from the bottom of my heart that this man is possibly the greatest thing that could happen to our… https://t.co/yEYuRmFkNt",,False,Thu May 10 14:32:11 +0000 2018,8,994585897155858432
6,Twitter Web Client,"Friends, I was the only person at the @NewsOK #okgov forum who has never held public office. My answers were a litt… https://t.co/033pNqYRgz",,False,Tue Apr 24 22:37:56 +0000 2018,5,988909936632520704
15,TweetDeck,"We launched Instagram today &amp; are using the story feature to give you a real-time, behind-the-scenes look at campai… https://t.co/mS1ppoOtiW",,False,Mon Jan 15 16:42:10 +0000 2018,3,952944006425661440
53,Twitter Web Client,I had a wonderful time talking with members of the Kingfisher Community this morning! We are only a month away from… https://t.co/mA4QH0C7CZ,,False,Fri Oct 05 20:24:08 +0000 2018,17,1048307873057591296
3,Twitter for iPhone,@KennedyKirby5 @DrewForOklahoma I would change laws that are making our state agencies unaccountable to the will of… https://t.co/GVFNWt8Oue,KennedyKirby5,False,Sun Sep 30 02:00:36 +0000 2018,1,1046218222469623808
110,Twitter for iPhone,I’m looking forward to working alongside @mattpinnell as we unify the party &amp; cast a bold vision to led OK to… https://t.co/CV8knZd3Bt,,False,Thu Aug 30 00:38:48 +0000 2018,28,1034963613423988737
136,Twitter Web Client,"Oklahomans have spoken, and they’re ready for change. To everyone who voted &amp; made our runoff victory possible: tha… https://t.co/dN3zUMfivE",,False,Thu Aug 30 17:43:32 +0000 2018,38,1035221493347696640
39,Twitter for iPhone,"After the @OKCattlemen governor forum today, I was craving a juicy steak! Great event. Awesome people. Thanks for h… https://t.co/oES1hRpXTf",,False,Sun Jul 22 01:47:50 +0000 2018,6,1020847856415117314
7,Twitter Web Client,"The US is creating an average of 15,000+ new manufacturing jobs PER MONTH! At the COMA gubernatorial forum, I commi… https://t.co/7DsYXYrEck",,False,Fri Dec 08 18:05:49 +0000 2017,2,939194318123921408
24,TweetDeck,"Cyril &gt; Frederick &gt; Hollis &gt; Tulsa! I am so grateful for Oklahomans who are coming to our public meetings, offering… https://t.co/8EFvAwxoD6",,False,Tue Jul 31 00:08:26 +0000 2018,10,1024084333802545152
214,TweetDeck,It was a special morning getting to join my oldest daughter as she cast her first vote! #TeamStitt https://t.co/vworZ3l14b,,False,Tue Nov 06 21:17:16 +0000 2018,26,1059917659494604801
11,Twitter Web Client,"""If anyone in this state has the business mind and the tools to correct and reset the direction of Oklahoma, it is… https://t.co/n0ReuCAp6G",,False,Sat Jun 09 13:02:31 +0000 2018,2,1005434969492205568
12,joe.sentry,"""I’m voting for Kevin Stitt for governor because he is not a career politician. He is the only candidate who has cr… https://t.co/k0miDW76O7",,False,Sun Jun 03 23:00:56 +0000 2018,3,1003411237500268545
69,joe.sentry,I'm excited to announce our campaign has received the endorsement of former 3rd District Congressmen Wes Watkins. I… https://t.co/0W4EdEnuEr,,False,Sat Oct 20 19:00:04 +0000 2018,26,1053722536305934336
54,joe.sentry,"Congressman Lucas has served as a champion of rural OK over the years, and I look forward to working with him in or… https://t.co/KpduBupojT",,False,Mon Nov 05 14:30:03 +0000 2018,20,1059452790848872448
7,TweetDeck,I greatly appreciate the turnout at our events this week! The momentum continues to grow of those ready for an outs… https://t.co/bt5o8lpPQe,,False,Sat Apr 07 17:20:30 +0000 2018,2,982669457519673344
22,TweetDeck,"At my company, we conduct regular audits at our 165 field offices across 41 states. This is essential to transparen… https://t.co/DM8SkfSnK6",,False,Wed Aug 08 01:39:00 +0000 2018,6,1027006228550045696
0,TweetDeck,"“'The problem is they're really bad business people,' COO of the Health Department told lawmakers in December""",GovStitt,False,Mon Apr 16 19:38:24 +0000 2018,0,985965652233113606
47,TweetDeck,THANK YOU to our volunteers who made phone calls and knocked on doors today to let Oklahomans know to #VoteStitt on… https://t.co/8nIL7dv63Y,,False,Sat Aug 11 19:49:23 +0000 2018,14,1028367796000972800
22,Tweetbot for Mac,We are looking forward to celebrating the 4th of July in Moore! We have a booth for the event and hope you’ll stop… https://t.co/wUw6mkoorg,,False,Mon Jul 02 19:04:24 +0000 2018,8,1013860963169263618
7,Twitter Web Client,"""I am supporting Kevin Stitt for #okgov at a time when our state is craving new leadership. Kevin is a proven job c… https://t.co/ag0NlZVKJ0",,False,Tue May 22 20:57:26 +0000 2018,3,999031504763269120
6,Sprout Social,"""No matter how long it may take us to overcome this premeditated invasion, the American people in their righteous m… https://t.co/Q3MorPn9rk",,False,Thu Dec 07 17:20:32 +0000 2017,1,938820533986131968
10,joe.sentry,"We had an awesome meet and greet in Miami and ended our town visit w/a tour of Newell Coach. As governor, I will wo… https://t.co/MJx85L8i5i",,False,Fri Dec 22 15:15:06 +0000 2017,3,944224784380039168
9,Tweetbot for Mac,I’ve had some great Meet &amp; Greet events over the past few weeks and one question that keeps coming up is: where can… https://t.co/NIhhiIQ4AP,,False,Tue Mar 27 20:11:27 +0000 2018,3,978726214272765953
3,TweetDeck,"On Friday evening, we saw a failure of leadership by career politicians. As I have traveled the state, Oklahomans a… https://t.co/bB4cNaRQip",,False,Sun Nov 19 21:21:20 +0000 2017,1,932358150883303424
18,Tweetbot for Mac,It’s an honor to be endorsed by Tulsa Firefighters @IAFFLocal176! A Stitt admin is going to deliver accountability… https://t.co/BcDdVup0if,,False,Thu Jun 07 15:30:53 +0000 2018,10,1004747529773309952
45,Twitter for iPhone,"Enjoyed sharing lunch and good conversation today with the people of Lane, Oklahoma! #VoteStitt #JointheTurnaround https://t.co/vELa0v5h3j",,False,Sat Oct 06 19:57:12 +0000 2018,15,1048663485196976129
6,Twitter Web Client,I promised to get back to the basics of budgeting with line item budgeting and performance metrics. We also need re… https://t.co/RXSHo52WM1,GovStitt,False,Tue Apr 24 22:37:57 +0000 2018,3,988909939170168832
13,joe.sentry,"While we were the only Republican gubernatorial team at the Tulsa #MarchforLife on Sunday, I was proud to see a str… https://t.co/0HSEYOhNtb",,False,Fri Jan 19 22:15:05 +0000 2018,3,954477340612063232
4,Tweetbot for Mac,"I'm going to be in Inola for a Meet &amp; Greet this Thursday, March 29th from 6:30pm-7:30pm. If you're in the area, I… https://t.co/DtXwq5jTSW",,False,Mon Mar 26 16:01:24 +0000 2018,2,978300897129304064
3,joe.sentry,Interested in voting absentee in the June 26 GOP Primary? The final day you can request an absentee ballot is June… https://t.co/vIE40KKY6P,,False,Wed May 23 13:00:08 +0000 2018,3,999273775848935425
11,Twitter Web Client,"""For a few minutes, she reframed a gubernatorial campaign that has featured lots of bloodless talk about budget pol… https://t.co/uDu6YM8vhU",,False,Mon Jun 11 21:00:30 +0000 2018,7,1006280034804551681
82,Twitter for iPhone,Ended the day by taking one of my sons to the Tulsa Fair for the livestock premium auction! cc @OKYouthExpo https://t.co/Kl0fAnebNi,,False,Fri Oct 05 01:26:52 +0000 2018,21,1048021672324997124
3,Twitter for iPhone,LIVE on KFAQ @PC1170 until 7:30AM. Tune in! https://t.co/ADg6tSX2dn,,False,Thu Jan 11 13:19:23 +0000 2018,0,951443424250597376
63,Tweetbot for Mac,I understand the challenges of starting and running a business. That is why I’m thrilled to have the endorsement of… https://t.co/3hH5zLK64u,,False,Wed Oct 17 13:05:56 +0000 2018,26,1052546253249236992
90,Tweetbot for Mac,Pleased to report the Tulsa Firefighters PAC--representing over 700 active &amp; retired firefighters--have endorsed my… https://t.co/u2n4ND27Jy,,False,Fri Oct 26 16:51:08 +0000 2018,28,1055864415394906114
4,Tweetbot for Mac,"For our official #Stitt4Gov press release today on #okgov filing, please check it out here: https://t.co/zSyiddNj8H",,False,Thu Apr 12 17:35:39 +0000 2018,0,984485211303022592
58,Twitter Web Client,It is a great honor to be Sarah’s husband. Don’t miss this video where she shares her vision for OK &amp; desire to hel… https://t.co/P8AEMRDAr1,,False,Sun Sep 30 19:15:47 +0000 2018,22,1046478736105893888
27,joe.sentry,"Thanks for joining the team, Sen. Murdock. Let's get Oklahoma's turnaround started right here, right now! https://t.co/YteiJEWBJo",,False,Sat Aug 25 21:15:04 +0000 2018,8,1033462789476634624
42,Twitter Web Client,Honored to have @RickSantorum's endorsement in the #okgov race. He is a champion for our conservative values &amp; I am… https://t.co/NvWaNjyq10,,False,Mon Aug 06 16:19:27 +0000 2018,25,1026503027778367488
15,Tweetbot for Mac,"Billy Graham – “America’s Pastor” – will be missed, but his legacy of putting the Gospel of Jesus Christ first, abo… https://t.co/oAjrgiPRed",,False,Wed Feb 21 15:37:06 +0000 2018,4,966335983200370693
17,TweetDeck,"Career politicians cannot get Oklahoma out of this mess. For the past 2 decades, I've balanced budgets, created job… https://t.co/AHlGkFGDrd",,False,Wed Aug 08 01:06:18 +0000 2018,4,1026998000399384576
129,TweetDeck,“I’m going to lead Oklahoma to change. It’s not going to be more of the same with me. I’m going to lead differently… https://t.co/XQubWaZeaU,,False,Sun Oct 14 23:43:10 +0000 2018,44,1051619453631426561
6,Twitter Web Client,Thank you to @KOKCradio’s @TodOnTheRadio for having me on the show this morning! Tod and his crew asked me about th… https://t.co/eYnJQIZUGA,,False,Fri Mar 30 21:52:21 +0000 2018,0,979838769665847297
3,Twitter Web Client,"""I am voting for Kevin Stitt because I feel like the hearts of our government leaders should match the hearts of th… https://t.co/f7VAwfLLvD",,False,Fri May 18 15:11:26 +0000 2018,0,997494877540814848
27,Twitter Web Client,"""I support Kevin Stitt for governor because he is a man of integrity."" – Shelly #JointheTurnaround #VoteStitt https://t.co/o05If3XxI4",,False,Fri Apr 27 14:38:04 +0000 2018,7,989876339267264513
6,TweetDeck,"""For almost a year, department leaders had ignored warnings from staff, failed to take action once they acknowledge… https://t.co/nvjYeBXhz6",,False,Mon Apr 16 19:36:21 +0000 2018,3,985965136782426112
5,Twitter for iPhone,I joined Tulsa’s @PC1170 in studio this morning to give an update on the governor’s race &amp; talk current events. Ful… https://t.co/ka0e7MKLxe,,False,Thu Jan 11 14:23:00 +0000 2018,0,951459431023292417
108,Tweetbot for Mac,"The early #okgov numbers look promising, but they’re just that — early numbers. We can’t take our foot off the gas… https://t.co/51cR39XOP6",,False,Fri Sep 07 14:42:24 +0000 2018,38,1038075015646904320
