favorite_count,source,text,in_reply_to_screen_name,is_retweet,created_at,retweet_count,id_str
25,Tweetbot for Mac,"As we sprint toward the runoff election, one question I get from voters every day is: what’s your plan to turn our… https://t.co/oKDXcZrLGP",,False,Mon Jul 16 14:51:39 +0000 2018,15,1018870783047864326
60,TweetDeck,"Thanks, Aric, for your LTE in the NYTimes sharing why you will #votestitt today! I admire your passion at your age… https://t.co/IT1szZF9Vk",,False,Tue Nov 06 14:51:23 +0000 2018,22,1059820548572753920
29,TweetDeck,It was an honor to speak to the Tulsa Fraternal Order of Police! I'm thankful for these men and women who risk thei… https://t.co/FUMtuO9XFg,,False,Tue Aug 14 13:50:08 +0000 2018,9,1029364551958052865
206,Twitter for iPhone,Thank you to @TulsaPolice for your hard work and professionalism today with the @VP in town. We got to show off Okl… https://t.co/n6drykfSBO,,False,Fri Oct 19 01:00:19 +0000 2018,41,1053088420560539648
46,Twitter Web Client,"I am ready to end politics as usual in Oklahoma and lead our state to become Top Ten in growth, education, and infr… https://t.co/IT3THR6LZv",,False,Mon Sep 24 23:53:09 +0000 2018,15,1044374210301374470
8,Tweetbot for Mac,My heart breaks for the victims of this shooting and their loved ones. My family and I join fellow Oklahomans in pr… https://t.co/WjiF2jCwjp,,False,Fri May 18 16:00:43 +0000 2018,3,997507281083396096
92,joe.sentry,"We're closing in on Election Day &amp; we need to close strong. I have a plan to get OK’s turnaround started, and with… https://t.co/yZzExIZREM",,False,Sun Nov 04 19:45:04 +0000 2018,41,1059169680672411650
52,TweetDeck,Another wonderful gathering of Oklahoma women to hear Sarah speak today about our shared vision of leadership that… https://t.co/nDKdX3CQWj,,False,Fri Nov 02 21:08:09 +0000 2018,17,1058465813659824128
12,TweetDeck,"I appreciate the Enid News &amp; Eagle for endorsing a key platform of my campaign. Since early on in the primary, I ha… https://t.co/LBqKz77ZxS",,False,Fri Aug 03 17:25:38 +0000 2018,7,1025432515933294592
4,Twitter Web Client,The tax package being passed at the capitol this week will not give teachers a pay raise that is sustainable. That… https://t.co/qufkc8QwPc,GovStitt,False,Wed Mar 28 18:49:48 +0000 2018,0,979068050979815424
55,TweetDeck,"Stopped in Krebs, Oklahoma to join the DAV Center for a fish fry to benefit Oklahoma’s veterans. God bless our men… https://t.co/GL2ObmSayp",,False,Mon Sep 17 01:07:39 +0000 2018,16,1041493855739174912
21,TweetDeck,I am a lifelong Republican &amp; a conservative b/c I believe in the free market &amp; in smaller gov’t. I believe in indiv… https://t.co/p3TiE06xWc,,False,Wed Aug 08 01:27:55 +0000 2018,6,1027003437727318017
7,TweetDeck,"We have already hit some MAJOR goals for our campaign!  We’ve made 100,000 calls to voters &amp; finished the 1st round… https://t.co/SVwnPrIf7Y",,False,Sat Feb 10 01:25:40 +0000 2018,0,962135447400079360
0,Twitter for iPhone,@kassidyRN45 I hope we get to meet you at one of our events!,kassidyRN45,False,Mon Jan 22 18:21:25 +0000 2018,0,955505695952113664
7,joe.sentry,"The first #okgov debate begins in one hour! If you won’t be there to watch, tune-in live on Tulsa 912 Project’s Fac… https://t.co/PHejv32FtK",,False,Tue Feb 13 23:30:05 +0000 2018,2,963555910907039744
9,TweetDeck,"Thank you, Okmulgee County GOP, for giving me the opportunity to speak at your meeting last night! We had a great c… https://t.co/QZZvixUgJB",,False,Wed Dec 13 23:57:10 +0000 2017,1,941094677519970304
30,Twitter Web Client,We need to look at video technology opportunities in order to bring students in our rural communities a broader ran… https://t.co/YwRE9DbZLo,,False,Mon Sep 24 23:48:29 +0000 2018,13,1044373035300605952
143,Twitter for iPhone,Taking a pause this morning to be a dad. I’m so proud of my son Drew who recently turned 16. Hopping in the back se… https://t.co/hP534Pbehs,,False,Tue Oct 23 16:57:23 +0000 2018,18,1054778826905931776
72,Tweetbot for Mac,"I’m proud to have the support of former Oklahoma City Mayor, Mick Cornett. He's joined a growing list of individual… https://t.co/3dbrA3Vsk3",,False,Mon Nov 05 13:27:30 +0000 2018,25,1059437048942206977
28,joe.sentry,"Thanks for joining the team, Sen. Kidd. Let's get Oklahoma's turnaround started right here, right now! https://t.co/rE42qDGFBs",,False,Mon Aug 27 13:00:08 +0000 2018,5,1034063010866896896
0,Twitter for iPhone,@apseanmurphy @meanjean99 @ThriceSavage @CathJSweeney Correct. We were already committed to meet with them at 12PM.,apseanmurphy,False,Fri Aug 10 16:34:06 +0000 2018,0,1027956265383866368
21,Tweetbot for Mac,How do we prevent another Health Department fiasco? Easy. We put OK’s checkbook online so that folks know how our g… https://t.co/KhwY8SlTVd,,False,Fri May 18 20:44:57 +0000 2018,6,997578813398712322
28,Twitter for iPhone,We enjoyed attending the  @OklaChildAdv’s Hero’s Ball last night &amp; celebrating the many Oklahomans who committ thei… https://t.co/j2CHHgmImi,,False,Sat Jul 28 13:45:53 +0000 2018,4,1023202890461134850
78,Tweetbot for Mac,"I am ready to lead OK to Top Ten, &amp; we will get there by channeling our OK values! While my opponent recruits suppo… https://t.co/ML5AWnXRG8",,False,Mon Oct 08 18:57:21 +0000 2018,31,1049373199149006848
2,Twitter for iPhone,"@arygarduno great question! What advice do you have? I speak &amp;listen to college groups (local political clubs, poli… https://t.co/J5QYPO8u8z",arygarduno,False,Fri Sep 28 01:43:47 +0000 2018,0,1045489211888021505
10,Tweetbot for Mac,I learned a lot during my visit to Altus High School yesterday. I can’t thank the AP Government Class enough for in… https://t.co/1u10xFVixy,,False,Wed Feb 28 14:54:56 +0000 2018,3,968862087622594560
5,Sprout Social,Good news: Oklahoma currently has the cheapest gas in the nation! A welcomed treat for everyone who is traveling to… https://t.co/EhKVAtgYaY,,False,Tue Dec 12 15:39:57 +0000 2017,1,940607160995733504
8,Twitter Web Client,"""I relate to Kevin Stitt b/c just like how he has gone after &amp;fulfilled his American Dream, I have done the same as… https://t.co/hb1lqasUVO",,False,Sat May 19 12:34:05 +0000 2018,2,997817669289238528
22,Twitter Web Client,"My granddad was a dairy farmer in Skiatook - he never took a day off &amp; was up at 3am every day. As the next #okgov,… https://t.co/lHYNGdvTYx",,False,Wed Jun 06 15:48:47 +0000 2018,4,1004389648632877056
10,Twitter for iPhone,Tune in now to @RealTodTucker show now on KOKC! Celebrating Tod’s one year anniversary. #TodTuckerNobodyClub https://t.co/mNgdfksUQW,,False,Tue Jan 23 12:38:24 +0000 2018,3,955781763372142593
6,Sprout Social,OSU is on the verge of making history! This could be their third straight year of winning 10 games in a season. All… https://t.co/f39sMgqNUU,,False,Fri Dec 15 15:00:15 +0000 2017,0,941684333202505728
22,Twitter Web Client,I’m excited to sign the Oklahoma Taxpayer Platform proposed by Tom Coburn. We need accountability in government. We… https://t.co/mKhulfjQuI,,False,Wed Mar 28 18:45:53 +0000 2018,4,979067066459328513
8,Tweetbot for Mac,"I’ve been saying this on the campaign trail since day one. We can’t accept the status quo any longer, and it’s goin… https://t.co/6PyuMz7EkA",,False,Mon Mar 19 14:28:30 +0000 2018,5,975740802746978305
30,Twitter Web Client,"I will ask the legislature for the authority to fire agency heads. Currently, many agencies and boards are unaccoun… https://t.co/S7QBUaEQZI",GovStitt,False,Tue Sep 25 00:05:34 +0000 2018,15,1044377334424510466
14,Twitter Web Client,It's hard times in OK; career politicians who got us into this mess aren’t going to get us out. That's why I am run… https://t.co/zaOmVfp5Ow,,False,Wed Apr 04 15:42:56 +0000 2018,8,981557741411020800
11,Tweetbot for Mac,"We’re counting down the days until the June 26th #okgov primary election, and we need your help to close strong. Wa… https://t.co/0c35Xs3tuT",,False,Tue May 22 16:23:08 +0000 2018,5,998962473805008899
8,Twitter for iPhone,THANK YOU for the awesome turn out at our Meet &amp; Greet in Altus and then also at the Southwest Oklahoma Republican… https://t.co/q2rwuhL0JY,,False,Wed Feb 28 02:32:13 +0000 2018,3,968675174521495552
11,Tweetbot for Mac,We are facing hard times here in Oklahoma. Our message is resonating with voters: the career politicians who’ve got… https://t.co/PqTUKngJ9y,,False,Tue Feb 13 17:03:35 +0000 2018,4,963458641654374400
19,TweetDeck,"On Saturday, we held 2 townhall meetings, one in Shawnee and the other in Stroud. Two of my kids and I ended the da… https://t.co/6gF8j05Y2p",,False,Sun Jul 29 21:21:37 +0000 2018,6,1023679963789189121
12,TweetDeck,But audits aren't the only answer! We have to also put Oklahoma's checkbook online so that agencies are held accoun… https://t.co/uCcnCIMb7t,,False,Wed Aug 08 01:39:50 +0000 2018,4,1027006438172962816
17,joe.sentry,"Thanks for joining the team, former Sen. Mazzei. Let's get Oklahoma's turnaround started right here, right now! https://t.co/35nDHaqZsi",,False,Mon Aug 27 20:05:06 +0000 2018,3,1034169957104451584
67,TweetDeck,We need to capitalize on President Trump’s tax cuts in order to grow and diversify our economy. As an experienced j… https://t.co/gvUyghalDi,,False,Thu Aug 23 00:58:34 +0000 2018,25,1032431870603157504
62,Twitter Web Client,On the first day of a Stitt Administration we are going to reform state government so that we deliver accountabilit… https://t.co/0Yg7qIcebR,,False,Tue Sep 25 00:05:34 +0000 2018,21,1044377333392703489
0,Twitter for iPhone,@rancowfan @kfor I did not sign the petition,rancowfan,False,Sat May 05 13:54:13 +0000 2018,0,992764406147796994
5,joe.sentry,We’re approaching a very important end-of-quarter fundraising deadline at midnight on March 31st. We need to close… https://t.co/ZGwDYWjMwN,,False,Fri Mar 30 13:25:05 +0000 2018,3,979711108956262402
25,TweetDeck,"I support President Trump. I will work with his administration, and support its agenda for a strong national defens… https://t.co/iZ1xyUY44u",,False,Wed Aug 08 01:29:58 +0000 2018,10,1027003954226491392
46,TweetDeck,"""We can change it. I believe with the right leadership, Oklahoma can be a Top Ten state. But I also believe the car… https://t.co/Ro24k1un6I",,False,Thu Oct 25 00:07:12 +0000 2018,18,1055249381379788800
13,Twitter Web Client,"""Over the past 10yrs, I have personally seen how Kevin Stitt is the real deal in his faith, character, &amp; in how he… https://t.co/pJCNxImjwb",,False,Tue Jun 05 17:40:17 +0000 2018,6,1004055319457222656
30,Twitter for iPhone,My promise to you: as your next governor I will make the hard decisions that are right for the next generation and… https://t.co/7JYzB0hf2g,,False,Thu Oct 18 22:23:10 +0000 2018,14,1053048870316449793
16,TweetDeck,"I will bring business practices to state government. Just like in business, we will start by enforcing line item bu… https://t.co/7nxvcGnxD7",,False,Tue Apr 03 19:48:32 +0000 2018,6,981257159064412165
191,Twitter Web Client,I am thrilled to announce that former Oklahoma City Mayor @MickCornett has endorsed my campaign to be the next… https://t.co/ym7ylQWkMK,,False,Thu Oct 11 14:54:43 +0000 2018,66,1050399302865100801
2,Tweetbot for Mac,"To declare your party, you will need to resubmit a voter registration form by MARCH 31!  Forms can be downloaded at… https://t.co/6w3RsQd5h8",GovStitt,False,Tue Mar 20 19:04:58 +0000 2018,1,976172765316288512
18,Twitter Web Client,"I'm excited to share my new commercial with all of you! ""Let Me Ask You"" is themed on the town halls we’ve hosted i… https://t.co/qb6lTepPtk",,False,Mon Apr 09 20:02:38 +0000 2018,9,983435035238977538
3,Twitter for iPhone,@RoubenTourian @tag42768 @DrewForOklahoma Rouben is correct. I do not support the negative ads from the dark money… https://t.co/wOdPOW2ijH,RoubenTourian,False,Fri Sep 28 01:44:58 +0000 2018,2,1045489511445204993
13,TweetDeck,"#oklaed, the pledge I signed does not impact or reference teacher pay. Throughout my campaign I have promised a Sti… https://t.co/sIQFXhbkYc",,False,Sun Apr 29 21:44:11 +0000 2018,10,990708347937677312
2219,Twitter for iPhone,"What a crowd! 1,800 proud Oklahomans gathered together in support of @StittforGov and @VP Mike Pence. https://t.co/4swGtHSGjo",,False,Thu Oct 18 21:26:17 +0000 2018,394,1053034556528443393
78,joe.sentry,The Tulsa Firefighters PAC -- representing over 700 active and retired members of the Tulsa Firefighters -- have en… https://t.co/Frepts7Khv,,False,Mon Nov 05 16:30:02 +0000 2018,32,1059482985588801536
20,Tweetbot for Mac,ICYMI: I am still overwhelmed by the incredible outpouring of support we had at our election night party. The energ… https://t.co/2dnuVvT0MQ,,False,Fri Jun 29 14:19:55 +0000 2018,6,1012702203595722754
38,joe.sentry,"Appreciate the incredibly kind words and endorsement from Tulsa Today Publisher, David Arnett. To get Oklahoma turn… https://t.co/EjbCPWTqNT",,False,Fri Aug 24 19:00:04 +0000 2018,10,1033066428985950208
70,Tweetbot for Mac,Appreciate Sen. Tom Coburn’s support for our campaign. Senator Coburn &amp; I agree that OK needs to be delivering core… https://t.co/Eombv7gvJL,,False,Tue Aug 21 16:11:24 +0000 2018,37,1031936816574812161
11,Sprout Social,Happy Thanksgiving! I made a brief video of what I am thankful for about Oklahoma and my first few months on the ca… https://t.co/EwDWrJOkoe,,False,Thu Nov 23 15:45:16 +0000 2017,2,933723128638967808
6,Tweetbot for Mac,"News has broken that the federal gov't is investigating OK Tourism Dept, &amp; there's been another OK Health Dept resi… https://t.co/ztWkZ9Mtsc",,False,Fri Dec 01 17:48:23 +0000 2017,4,936653214270853121
15,TweetDeck,"THANK YOU to all who came to our GOTV rallies in Tulsa and OKC! Saturday until election day, we will be out in Enid… https://t.co/tIwcWtzUS3",,False,Fri Jun 22 20:51:48 +0000 2018,2,1010264109743566848
65,Twitter Web Client,"During the course of the campaign, I have met many young men and women who are settling back in Oklahoma after serv… https://t.co/9MEZctaRdB",,False,Tue Sep 11 15:09:43 +0000 2018,11,1039531438280978432
18,Twitter Web Client,"""Kevin Stitt wants long term solutions for our state and he will deliver it with compassion and accountability. Tha… https://t.co/6AWeFpFGvM",,False,Sun Jun 24 19:49:42 +0000 2018,6,1010973257003077633
36,Twitter for iPhone,Thank you to our Stitt supporters for showing the team spirit in OU’s homecoming parade today! https://t.co/stwn4h66Uo,,False,Sat Oct 27 18:34:54 +0000 2018,14,1056252918721064960
51,TweetDeck,"""We have 6 children – 17  to 4 and I want to thank them too. The truth is, our children are a big reason I’m runnin… https://t.co/Beq1VdPsP5",,False,Thu Oct 25 00:05:13 +0000 2018,15,1055248882769248256
10,Twitter Web Client,"""Kevin Stitt is a proven business leader, a problem solver. Kevin knows what it means to craft &amp; implement a sustai… https://t.co/7tH9JrkfWQ",,False,Thu May 17 14:12:04 +0000 2018,1,997117549702721536
9,TweetDeck,Enjoyed starting the day at the Iron Man Bible Study in Tulsa! https://t.co/jKGnpmgiMa,,False,Fri Jun 22 14:06:21 +0000 2018,2,1010162074868244484
6,TweetDeck,"Thank you to all who came to our town halls this week! Pictured below are our meetings in Antlers, Idabel, Coalgate… https://t.co/Q1o72L0TGG",,False,Fri Feb 02 22:40:18 +0000 2018,1,959557114166501378
206,joe.sentry,"Everything we've worked for comes down to this moment. In five more minutes, polls will open. I need your vote toda… https://t.co/GboNU6Llx5",,False,Tue Nov 06 12:55:07 +0000 2018,78,1059791285396094976
1,Twitter for iPhone,@MarlowReview Thank you for attending and covering the public event,MarlowReview,False,Sat Jun 23 03:10:53 +0000 2018,0,1010359509318062080
6,Twitter for iPhone,I enjoyed making new friends in Shawnee tonight and appreciate all who came out to discuss how we can work together… https://t.co/ZU3DSIejpP,,False,Fri Apr 13 01:20:27 +0000 2018,0,984602181419532288
5,TweetDeck,Today is our 2nd Day of Action for #TeamStitt! This team of three is showing us how door knocking is done!… https://t.co/932nqLHb5Y,,False,Sat Apr 14 16:42:37 +0000 2018,0,985196637864714240
3,Twitter for iPhone,@SaraHow89484141 A portion of property tax can only be used for school buildings. SQ 801 would give local schools t… https://t.co/Si1YMdmQEe,SaraHow89484141,False,Sun Sep 30 02:18:12 +0000 2018,2,1046222649909805057
4,TweetDeck,I enjoyed attending the Tulsa Farm Show last night &amp; continuing a conversation about the agriculture community's vi… https://t.co/PmgyU8mslk,,False,Sat Dec 09 15:03:19 +0000 2017,0,939510780080410624
7,TweetDeck,I believe that Oklahoma's teachers need to be paid more and be valued as a profession. They are on the front lines… https://t.co/5qG65QT6qK,,False,Wed Aug 08 01:13:35 +0000 2018,3,1026999831192109056
3,Tweetbot for Mac,"OK voters - No party, no vote in the upcoming GOP primary for Oklahoma’s next governor. If you are a registered vot… https://t.co/zZjrp2QSF0",,False,Tue Mar 20 19:00:19 +0000 2018,4,976171594023391232
33,TweetDeck,"I've balanced budgets, cast vision, applied performance metrics, held people accountable and made hard decisions. I… https://t.co/Qn6dByqlRZ",,False,Thu Aug 23 00:59:11 +0000 2018,12,1032432025431666688
70,joe.sentry,BREAKING: A new @MagellanStrat poll shows us pulling into the lead in the #okgov race. The poll has us at 51% and o… https://t.co/zdlrGJrzz8,,False,Wed Oct 24 23:45:04 +0000 2018,30,1055243812304576515
1,Twitter for iPhone,@Divis10nSpec Absolutely. Will you please email Korbin your address and will get it delivered to your house kirwin@stittforgovernor.com,Divis10nSpec,False,Sun May 13 20:05:45 +0000 2018,0,995757008216379392
6,TweetDeck,"If a football team is failing, you don’t get rid of the coach and then hire a replacement from your bench. You recr… https://t.co/Epc6mDYxDc",,False,Sun Nov 19 21:22:30 +0000 2017,0,932358445180833792
12,Tweetbot for Mac,"Our Turnaround Team is growing every single day, and I’m excited to see so many folks signing up to join us. If you… https://t.co/p2qNY0xbqr",,False,Tue Apr 17 16:23:11 +0000 2018,3,986278910617968642
6,Tweetbot for Mac,"Yesterday, I sat down for a discussion with Lee Matthews on @newsradioktok. As I told him, I’m going to be a govern… https://t.co/mVeol6H4HS",,False,Thu Mar 08 18:42:22 +0000 2018,6,971818422345584640
4,TweetDeck,Our fellow Oklahomans continue to battle devastating wildfires. @News9 has a piece on how we can stand together as… https://t.co/YVK8QTe4Uz,,False,Wed Apr 18 11:41:53 +0000 2018,4,986570507972743168
101,joe.sentry,We’ve got more big news this morning: We’ve just received the endorsement of The Oklahoman Editorial Board! Their s… https://t.co/aoiMaANnKz,,False,Sun Oct 21 15:05:05 +0000 2018,42,1054025790021664769
59,TweetDeck,We ended Saturday with a townhall meeting in McAlester at the popular bowling alley called Great Balls of Fire. Tha… https://t.co/JTizySAjDh,,False,Mon Sep 17 01:09:06 +0000 2018,16,1041494219762884608
19,Twitter Web Client,"Conservatives want change only an outsider can bring. We've tried career politicians, but it’s time for a leader wh… https://t.co/fNYFZYWS1k",,False,Fri Jun 15 18:54:59 +0000 2018,11,1007698000058175488
10,TweetDeck,"ICYMI: KSWO-TV has a great piece about our campaign's priorities to grow Oklahoma's economy, make it a top 10 state… https://t.co/Cql8uzpfTP",,False,Tue Dec 26 22:47:32 +0000 2017,3,945788196654338049
5,Twitter Web Client,The U.S. is experiencing tremendous economic momentum! I'm ready to take my success in the private sector to help o… https://t.co/qCudYZYy4T,,False,Mon Dec 18 16:02:44 +0000 2017,2,942787220464963584
64,Twitter for iPhone,"My daughter, Piper, celebrated her birthday on the campaign trail this week! Thank you to the Altus community and f… https://t.co/f2x3v2AQ2B",,False,Wed Oct 31 18:13:27 +0000 2018,15,1057697071086686208
12,joe.sentry,DEADLINE ALERT: June 1st is the last day to register as a voter in Oklahoma in order to have your voice heard in th… https://t.co/yBTOQHEBmc,,False,Wed May 23 00:00:05 +0000 2018,10,999077468370849794
11,Sprout Social,I had a great time learning from fellow Oklahomans at the Cleveland City Chamber &amp; Rotary Meeting. https://t.co/82DukRUtS2,,False,Tue Nov 07 21:00:07 +0000 2017,2,928004158086578176
19,Tweetbot for Mac,Want to show off your support for our campaign? Download one of our Facebook profile frames today &amp; help us continu… https://t.co/oKNwCGuYhB,,False,Thu Jul 05 22:37:19 +0000 2018,4,1015001705455513602
7,Sprout Social,"Today, I’ll be hosting my first town hall in Chickasha from 1:30-2:30 p.m. at the Chickasha Public Library. Hope to… https://t.co/jzkauXEZYa",,False,Mon Nov 13 15:00:19 +0000 2017,2,930087939626995713
48,Twitter for iPhone,#TeamStitt #GoPokes #beattexas https://t.co/iduEi36BUM,,False,Sat Oct 27 19:57:45 +0000 2018,17,1056273766320357378
9,Tweetbot for Mac,ICYMI: Check out my closing statement from the #okgov debate earlier this week in Tulsa. I offer three reasons why… https://t.co/bEq0FgbGdG,,False,Thu Feb 15 19:58:46 +0000 2018,4,964227506952957953
8,Twitter for iPhone,Looking forward to being in studio to celebrate! https://t.co/JvBiUzqZc0,,False,Mon Jan 22 23:42:58 +0000 2018,2,955586618823532544
5,Twitter for iPhone,More #TeamStitt pictures in from our #DayofAction going on in 5 cities across Oklahoma! https://t.co/8Oas5ULjhA,GovStitt,False,Sat May 19 18:16:31 +0000 2018,2,997903847157829637
84,Twitter for iPhone,"With Kevin Stitt in the governor’s office in Oklahoma, with renewed Republican leadership in the statehouse, with r… https://t.co/HDORkO3CWW",,False,Thu Oct 18 22:58:43 +0000 2018,30,1053057817752625154
7,Twitter Web Client,We had a robust conversation today in Harper County! Their major concern? The mismanagement of our state agencies.… https://t.co/DWk6Y2Hrm0,,False,Thu Jan 04 21:15:44 +0000 2018,2,949026583079243778
5,Sprout Social,Tune in tomorrow (Saturday) at noon to the Tulsa Beacon Radio Show on Tulsa's AM 970 KCFO! I appreciate Charley Big… https://t.co/OY2CvIony5,,False,Sat Nov 18 03:02:57 +0000 2017,2,931719348359782401
21,joe.sentry,"As the son of a pastor, I always looked forward to his #Easter sermon. Today, I hope you'll join my family and I in… https://t.co/fgpdWyfLm2",,False,Sun Apr 01 13:00:03 +0000 2018,4,980429588038811648
0,Twitter for iPhone,"@DustinJohnson21 When we were hit by the 2008 subprime crash, I had a savings that played a critical roll in helpin… https://t.co/YsH3ie3ovq",DustinJohnson21,False,Sat May 26 21:27:27 +0000 2018,0,1000488611341590530
2,Twitter for iPhone,@morganawheels Good question! Some big problems need bigger processes to deliver accountability! A big problem is l… https://t.co/qoAfAvkKqE,morganawheels,False,Sun Sep 30 02:04:14 +0000 2018,0,1046219135431176192
2,Twitter for iPhone,@revbmat @TheOklahoman @DrewForOklahoma Even a bipartisan “like” for your tweet,revbmat,False,Fri Sep 28 01:45:58 +0000 2018,1,1045489765443936256
89,joe.sentry,"Exactly 24 hours from now, polls will open up across OK and voters will have an opportunity to make their voices he… https://t.co/c1t4Cg2h34",,False,Mon Nov 05 13:00:06 +0000 2018,36,1059430152017461249
8,TweetDeck,Thank you to the Assembly of God Broken Arrow Church for allowing me to be the guest speaker at your Saturday men's… https://t.co/CEjOxh3Tgj,,False,Mon Jan 29 21:15:00 +0000 2018,2,958086097292144646
100,Twitter Web Client,"My opponent's running behind, so he's gone to ""Plan B"", running attack ads. I think that says more about him, than… https://t.co/i1OOUzRvfY",,False,Wed Aug 15 15:59:36 +0000 2018,55,1029759519658795008
18,Sprout Social,The politicians who got Oklahoma into this mess aren’t going to get us out of it. I want to make us a top 10 state! https://t.co/vuHodwhVzd,,False,Wed Nov 08 20:44:31 +0000 2017,5,928362619664203778
17,joe.sentry,Oklahoma's Turnaround starts with delivering transparency &amp; accountability in state government. I have a plan to pu… https://t.co/2yjPbrN4D3,,False,Sun Jun 03 17:30:04 +0000 2018,5,1003327972445704192
17,TweetDeck,I am the only governor candidate who has said since day one that we need to provide a competitive pay raise that re… https://t.co/8lXGyjOUxF,,False,Wed Aug 08 01:13:18 +0000 2018,5,1026999760513847297
8,Twitter Web Client,The US economy is booming - and economists are saying we could experience 3% GDP growth in 2018. I have the proven… https://t.co/As2DZANDVo,,False,Wed Jan 03 23:17:22 +0000 2018,2,948694805445570560
24,TweetDeck,We spent the past two days in OKC &amp; I am honored by the outpouring of support &amp; opportunity to share a vision to le… https://t.co/E9rUidyIL6,,False,Fri Aug 03 15:05:05 +0000 2018,8,1025397145585766400
30,Twitter Web Client,"As governor, I will work to create a signing pay bonus for teachers by partnering with school districts to match do… https://t.co/Sbp7vquOWK",,False,Mon Sep 24 23:41:40 +0000 2018,13,1044371317796016134
44,TweetDeck,"""By looking further ahead, empowering local school districts &amp; increasing students’ accessibility to the best educa… https://t.co/UFRw3xkyrL",,False,Sat Aug 25 19:22:14 +0000 2018,17,1033434392553840641
0,TweetDeck,"""Nichols urged lawmakers to view the Health Department's problems as part of a 'systemic issue' of poor practices.… https://t.co/bZD85FQINS",GovStitt,False,Mon Apr 16 19:40:35 +0000 2018,0,985966202173427716
1,Twitter for iPhone,"@SaraHow89484141 States like Missouri, Colorado &amp; Texas have more stable education funding due to their use of loca… https://t.co/OIMtExlyjw",GovStitt,False,Sun Sep 30 02:22:05 +0000 2018,0,1046223628252172289
