favorite_count,source,text,in_reply_to_screen_name,is_retweet,created_at,retweet_count,id_str
82,Tweetbot for Mac,"I have a plan for starting Oklahoma’s turnaround, and it starts with transparency and accountability to Oklahoma ta… https://t.co/LMgCLt3K38",,False,Fri Sep 21 14:05:55 +0000 2018,27,1043139261745254400
36,Twitter Web Client,I will audit our Medicaid program to reduce wasteful spending and ensure resources are supporting Oklahomans who ne… https://t.co/bdjz8LPaG4,,False,Mon Sep 24 23:59:24 +0000 2018,12,1044375781516955648
14,Tweetbot for Mac,"This is what it’s all about, right here. The community of Lane, Oklahoma rallying behind a man who lost his busines… https://t.co/PgjZlCMcxr",,False,Thu Mar 15 16:29:11 +0000 2018,3,974321621929472000
8,joe.sentry,"""We support Kevin Stitt for governor because of his proven ability to lead. We believe that the success he has had… https://t.co/G2tHtJ3KhJ",,False,Sun May 20 18:01:43 +0000 2018,0,998262506736046085
62,Twitter for iPhone,"The choice could not be more clear.  In Kevin Stitt, you have an outsider, a conservative, and a businessman who kn… https://t.co/bX46ulorZI",,False,Thu Oct 18 22:43:43 +0000 2018,31,1053054042652450817
41,TweetDeck,I appreciate Canadian Valley Career Tech for giving me a tour of their facility &amp; hosting our town hall meeting. Th… https://t.co/olcLh5Y1ZA,,False,Sat Sep 15 16:27:55 +0000 2018,9,1041000672840359940
6,Tweetbot for Mac,What did you think of the #SOTU address that @POTUS delivered this evening? I loved it! RT &amp; let me know what you t… https://t.co/2gc3Ki2I7U,,False,Wed Jan 31 03:34:47 +0000 2018,1,958544058191884288
68,Tweetbot for Mac,"Proud to have on board the OKAgFund, @okfarmbureau’s grassroots political action committee. With your support, and… https://t.co/KnEnZQPgdL",,False,Mon Sep 10 15:06:50 +0000 2018,20,1039168324456931328
4,TweetDeck,We have FIVE town halls today around the state of Oklahoma. We announce these meetings every week through our e-new… https://t.co/5PjtKqH7BC,,False,Mon Jan 22 14:57:39 +0000 2018,1,955454419163910145
8,TweetDeck,"This will take a team effort, and I will be asking Oklahomans to come serve with me from outside of politics so tha… https://t.co/v5pSpk4vwd",,False,Tue Apr 03 19:49:39 +0000 2018,4,981257441630478341
1,Twitter Web Client,We also need fair taxation in Oklahoma — and that means full tax reform. It’s going to take an outsider to fix the… https://t.co/8aVG1f8ga2,GovStitt,False,Wed Mar 28 18:49:47 +0000 2018,1,979068049394421760
10,Tweetbot for Mac,"To improve our educational system, ignite economic growth, and build stronger infrastructure, we need more governme… https://t.co/W9G4tK6P7P",,False,Wed Jan 17 15:56:00 +0000 2018,1,953657165457379329
113,Twitter Web Client,My opponent &amp; outside special interest groups have been relentless in attacking the business I built right here in… https://t.co/UaZPdX7fM0,,False,Wed Oct 31 23:24:47 +0000 2018,43,1057775422207860737
18,TweetDeck,"Our day was scheduled for Enid &amp;Norman, but we cleared out the afternoon to go to Woodward &amp; deliver supplies for t… https://t.co/472vwQgmmK",,False,Fri Apr 13 23:20:09 +0000 2018,6,984934295583281152
50,joe.sentry,"Make your voice heard between 7am and 7pm tonight. I am counting on your support &amp; your vote. Together, we can star… https://t.co/QjXaqAkmA7",,False,Tue Jun 26 11:55:07 +0000 2018,26,1011578600422825985
44,TweetDeck,"While Sarah was in OKC, the kids and I joined the Claremore community for the Will Rogers parade. Thank you to our… https://t.co/SZazwAO8Lo",,False,Fri Nov 02 22:43:00 +0000 2018,19,1058489680600027137
59,TweetDeck,Packed house in Bethany for a public meet and greet! I appreciate my wife Sarah joining me and sharing a few words… https://t.co/pjwwhY0RbJ,,False,Sat Oct 13 21:53:52 +0000 2018,20,1051229557985042433
50,TweetDeck,Enjoyed speaking to &amp; taking questions from Elgin Middle School students today! https://t.co/lV6Ab0T5pL,,False,Tue Sep 18 14:01:47 +0000 2018,12,1042051060775481346
7,joe.sentry,I'm pumped to see the @OSUWBB team has punched their ticket to the #NCAATournament. Hope the Cowgirls start off wit… https://t.co/k7owqJ6FfU,,False,Tue Mar 13 23:00:06 +0000 2018,2,973695222650753025
6,Twitter Web Client,"It’s #OKRoseDay, and I’m excited that the Oklahoma Capitol was packed this morning with so many #prolife leaders! A… https://t.co/cY8pj9HYwS",,False,Wed Feb 07 19:11:22 +0000 2018,2,961316475477921793
3,TweetDeck,But it is also important to recognize that Oklahoma’s crisis didn’t happen overnight. Oklahoma has experienced mult… https://t.co/yaNxRKbSmX,,False,Sun Nov 19 21:22:16 +0000 2017,0,932358385978273793
14,TweetDeck,"Rain or shine, it was great to get out to Guymon, Alva, and Grove today for our last set of town hall meetings befo… https://t.co/a0VQLiKE76",,False,Tue Jun 26 02:04:58 +0000 2018,3,1011430084232794112
53,Tweetbot for Mac,I appreciate everyone who came out in Miami yesterday to hear our discussion about how we can make Oklahoma Top Ten… https://t.co/PysLSUGybU,,False,Thu Sep 20 13:55:18 +0000 2018,15,1042774203513102336
15,Tweetbot for Mac,I am the only candidate in the #okgov race traveling the state to hear directly from voters at open town hall meeti… https://t.co/gRB1F712Qo,,False,Mon Jan 29 16:59:33 +0000 2018,5,958021811060473856
5,TweetDeck,We had another meeting and great in Tulsa this weekend! Would you like to host one for our campaign? Please let us… https://t.co/hxNfPGHOwc,,False,Sun Jan 28 15:46:00 +0000 2018,1,957640913265737734
83,TweetDeck,"""The cornerstones of Stitt’s message- pro-growth, less regs &amp; personal freedom-are the right ones. We need to capit… https://t.co/FjUhZiBGPK",,False,Tue Oct 09 15:29:54 +0000 2018,39,1049683380407808002
18,Tweetbot for Mac,"Agriculture is one of Oklahoma’s economic mainstays. As governor, I’ll make supporting our hardworking farmers &amp; ra… https://t.co/xG7jLRaLaA",,False,Mon Jul 23 14:59:46 +0000 2018,9,1021409541869760512
13,Tweetbot for Mac,"Election Day is getting closer, and June 26th will be here before we know it. Our team is working hard, and closing… https://t.co/JOqwbafbw3",,False,Wed Jun 13 15:25:10 +0000 2018,3,1006920419063025664
9,Tweetbot for Mac,We are the only campaign hosting well-publicized town halls in every county to answer questions and listen to Oklah… https://t.co/edapKu0omH,,False,Tue Jan 16 21:21:08 +0000 2018,2,953376600002842629
15,Tweetbot for Mac,I appreciate Roger Bruhn’s kind words of endorsement in his Tulsa World’s Letter to the Editor this morning!… https://t.co/a6JcE4YmB5,,False,Thu Feb 08 20:24:46 +0000 2018,7,961697332969525250
5,joe.sentry,"My family &amp; I had a great time at the Tulsa #MarchforLife this past weekend, and stand with our #prolife friends wh… https://t.co/uoNfOpVrRO",,False,Fri Jan 19 14:15:04 +0000 2018,1,954356539367854080
60,TweetDeck,#GovernorDebate #OKpol https://t.co/Dg8XCnNKuZ,,False,Thu Oct 25 00:39:19 +0000 2018,29,1055257464579518464
34,Twitter Web Client,"""Kevin Stitt wants long term solutions for our state and he will deliver it with compassion and accountability. Tha… https://t.co/fpdzdlILF6",,False,Sat Aug 11 13:01:04 +0000 2018,13,1028265038690353153
14,TweetDeck,"I believe that local school boards, community leaders and parents know how to best spend their local tax dollars, w… https://t.co/5gTzVPTBja",,False,Wed Aug 08 01:15:29 +0000 2018,2,1027000312626855937
15,TweetDeck,We are out door knocking in Tulsa and OKC for our 2nd #TeamStitt Day of Action. Enjoyed rallying with our Tulsa tea… https://t.co/IDnXNpe1PA,,False,Sat Apr 14 16:45:08 +0000 2018,7,985197273956208641
11,Tweetbot for Mac,I am excited about the strong national economic news rolling in regularly. I’m the only candidate in the #okgov rac… https://t.co/WNhSsXNPOr,,False,Wed Jan 31 20:17:29 +0000 2018,0,958796396827742211
24,Twitter Web Client,"We need to hold government accountable, because the folks running things now aren’t getting the job done. BIG thank… https://t.co/1VDgF4remb",,False,Fri Jun 08 13:21:50 +0000 2018,12,1005077440987836417
4,TweetDeck,"Throughout the campaign trail, I have said I support medical marijuana. We need a clear reg framework that ensures… https://t.co/BQfP4TIbbV",,False,Wed Aug 08 01:20:16 +0000 2018,1,1027001516496965633
69,Tweetbot for Mac,I’m looking forward to tonight’s #okgov debate sponsored by The Oklahoman. The debate will be held at 6:30p.m. at t… https://t.co/O3LyOUIbwm,,False,Mon Sep 24 15:00:20 +0000 2018,22,1044240121594347520
4,joe.sentry,WATCH: I spoke with a group at @usaodrovers this past Tuesday about why I’m running for governor. If we keep electi… https://t.co/7o1avNyMcx,,False,Tue Jan 16 01:00:04 +0000 2018,2,953069305050095617
5,Twitter Web Client,Fun Fact: Nearly 90% of individuals who gave this past quarter were new to our campaign! We are proud to be drawing… https://t.co/Z8lo26KDAr,,False,Wed Apr 11 23:06:35 +0000 2018,0,984206103054635008
8,TweetDeck,"In a Stitt administration, passage of SQ 801 will simply be the start of ongoing efforts to retain and recruit the… https://t.co/85NbRq0YQv",,False,Wed Aug 08 01:16:14 +0000 2018,5,1027000501290844162
11,Twitter Web Client,"""Kevin Stitt is a servant leader, one who operates at the foundation, pulling people in &amp; inspiring people to do th… https://t.co/EHc8aQSGnO",,False,Sun Jun 10 18:10:42 +0000 2018,1,1005874912735694848
44,TweetDeck,"""Good evening. I want to thank my wife Sarah. She’s a great partner and mother. We built Gateway into the homegrown… https://t.co/sW6Q5R0f1q",,False,Thu Oct 25 00:04:10 +0000 2018,14,1055248618993713152
0,TweetDeck,"""A small group of midlevel employees at the Health Department had kept detailed spreadsheets of the money the depar… https://t.co/gVGo860v69",GovStitt,False,Mon Apr 16 19:39:35 +0000 2018,0,985965950318137346
1,Twitter for iPhone,ICYMI https://t.co/ry1WVSHmAz,,False,Tue Feb 13 15:42:20 +0000 2018,0,963438197169672192
8,joe.sentry,"""I support Kevin Stitt for governor. I have seen first-hand how he runs his business, sets high expectations, attra… https://t.co/Op0AWh7Yjy",,False,Sat May 26 15:35:50 +0000 2018,2,1000400124709888008
12,TweetDeck,I appreciate the team at McElroy Manufacturing for giving me a tour of their operations. They have a great story of… https://t.co/EEo6IJEcsK,,False,Mon Dec 11 00:09:15 +0000 2017,3,940010554810302464
8,joe.sentry,"""I support Kevin Stitt for governor because he is an honest, hardworking man who has true conservative, Christian v… https://t.co/uXXukTqWYA",,False,Thu May 24 15:06:09 +0000 2018,2,999667878986174466
20,Twitter Web App,Kevin has called for a clean campaign and high ethical standards in this race. It is why he reached out directly to… https://t.co/sHCUoB3YCv,,False,Sat Dec 09 12:39:33 +0000 2017,3,939474599137497088
17,joe.sentry,"My favorite Christmas memories were of my dad leading his church congregation in the candlelight service, a special… https://t.co/rYRNlbGOHO",,False,Sun Dec 24 14:00:05 +0000 2017,5,944930682069045248
28,joe.sentry,"ICYMI: Since the New Year, three public polls have been run on the #okgov race. In that time, our campaign has SURG… https://t.co/WE0LZ9mjj6",,False,Fri Apr 27 19:00:07 +0000 2018,16,989942285608669186
15,joe.sentry,TODAY is the LAST day to request an absentee ballot for the August 28th #okgov runoff election. Apply online at the… https://t.co/uIdp7LhP0c,,False,Wed Aug 22 13:00:05 +0000 2018,7,1032251059983532033
77,Twitter for iPhone,Thankful for the support of fellow Oklahoma Republican leaders. Onwards to November! #JoinTheTurnaround https://t.co/cMjbt2n7XC,,False,Thu Aug 30 00:26:15 +0000 2018,16,1034960453108158465
86,Twitter Web Client,"Fellow Oklahoman and country music legend, Toby Keith, was an early member of Team Stitt. Thankful for his ongoing… https://t.co/X7lwr59Gdv",,False,Thu Aug 16 14:18:59 +0000 2018,31,1030096589132582913
89,Tweetbot for Mac,BREAKING: I’m excited to share that I’ve received the endorsement of the @TulsaWorld editorial board! I’m honored t… https://t.co/RS3ydFgzVJ,,False,Sun Oct 21 13:13:29 +0000 2018,27,1053997702407540738
12,Twitter Web Client,"""We are so tired of Oklahoma coming in at 48th and 49th of everything. I truly believe Kevin Stitt can get us back… https://t.co/ybX8tyYRM4",,False,Mon May 14 15:33:03 +0000 2018,2,996050768259174400
6,Twitter for iPhone,Thank you to the Broken Arrow Chamber for letting me come speak to and hear from your membership! #Stitt4Gov https://t.co/O8YJnl0DEt,,False,Thu Jan 04 17:18:07 +0000 2018,2,948966786803912707
16,Tweetbot for Mac,"They said an outsider for #okgov couldn’t get this type of traction, but they were wrong. We've brought in a total… https://t.co/wxih8mhRFM",,False,Wed Apr 11 23:05:58 +0000 2018,8,984205947055767553
111,Twitter for iPhone,"Thankful to have @VP Mike Pence in Oklahoma to endorse our message of change, of delivering a Top Ten State, of end… https://t.co/YyqdNxfFJG",,False,Thu Oct 18 21:34:42 +0000 2018,47,1053036675918688258
3,Twitter Web Client,"On January 3, our campaign will be at the Broken Arrow Chamber of Commerce at the Stoney Creek Hotel and Conference… https://t.co/UEXvRbygzG",,False,Thu Dec 28 20:05:55 +0000 2017,2,946472297799536640
15,Twitter Web Client,"""I’m voting for Kevin Stitt bc he is a growth guy. I’ve seen it 1st-hand for 25yrs, when he shattered company recor… https://t.co/4p0NfzF5xb",,False,Tue Jun 12 14:30:21 +0000 2018,5,1006544236660101120
29,TweetDeck,"State government is broken, and it is time to shake up the political establishment if we want lasting change. Throu… https://t.co/I7GiZ4ilJk",,False,Thu Aug 02 16:46:17 +0000 2018,12,1025060227245326336
7,Twitter for iPhone,"Thank you to @NewsOK for hosting the GOP Governors forum this evening. They delivered a professional, well-organize… https://t.co/qnJcJiVjB6",,False,Tue Apr 24 02:53:48 +0000 2018,5,988611938765758466
21,Twitter Web Client,"""One of the reasons I support Kevin Stitt for governor is his experience running and building a business. As a busi… https://t.co/PGvITO3SeW",,False,Mon Aug 13 13:08:50 +0000 2018,4,1028991771857104897
16,Twitter Web Client,"""A lot of people would be uncomfortable to show up to a hospital room to pray for someone they'd never met, but not… https://t.co/UX0BCaY3xS",,False,Thu May 03 14:59:48 +0000 2018,4,992056134960930816
57,Twitter for iPhone,I’m enjoying having my oldest with me on the campaign trail today! Natalie and I took a brief break between meeting… https://t.co/utldI6sa1v,,False,Mon Aug 20 20:58:37 +0000 2018,7,1031646710546800644
34,TweetDeck,It’s going to take an outsider and independent governor to deliver lasting conservative change to OK. I will be a g… https://t.co/soTKb9jtub,,False,Thu Aug 23 00:58:00 +0000 2018,14,1032431730496626688
61,Twitter for iPhone,Spending time this evening with the family at our favorite fall festival in Tulsa! #Halloween2018 https://t.co/grfgnz2c0O,,False,Wed Oct 31 23:36:38 +0000 2018,18,1057778404072796160
16,Twitter for iPhone,"We had a great day on the campaign trail in Tulsa, Stillwater and Edmond. We are closing out the evening by harvest… https://t.co/MRHEU9Hyep",,False,Sun Jun 17 01:44:28 +0000 2018,1,1008163434792398849
9,TweetDeck,"I had the opportunity to tour the Hartsock's brick plant in Wewoka. They shared w/me how heavy-handed, costly regul… https://t.co/sJm2tIDSbb",,False,Wed Jan 24 23:06:41 +0000 2018,1,956302263470915592
12,Twitter for iPhone,"@jrobgov Thank you for having me! My take away- bright kids. Awesome questions. As a State, we need to do better at… https://t.co/v7z5acXVkF",jrobgov,False,Tue Feb 27 22:39:44 +0000 2018,3,968616668762136576
10,Twitter for iPhone,🚨🚨Don’t miss this piece by the Pawhuska Journal-Capital about our recent town hall meeting in Osage County: https://t.co/8I8sG1j4vP,,False,Sun Jan 14 23:00:26 +0000 2018,2,952676809908346880
15,Twitter Web Client,"""Kevin Stitt is a man that loves God &amp; loves Jesus. He cares enough about his people that he put 2 corporate chapla… https://t.co/Ox303oTnaI",,False,Mon Apr 30 13:29:37 +0000 2018,4,990946273887969281
1,Twitter for iPhone,@arygarduno Great idea! We’d like to eventually start an Instagram too,arygarduno,False,Sun Sep 30 02:10:37 +0000 2018,0,1046220742873034752
70,TweetDeck,Thank you to our new friends in Cleveland for inviting my family to participate in the Pioneer Day parade! We had a… https://t.co/di5AKuxsNR,,False,Sun Sep 09 22:19:06 +0000 2018,12,1038914720554729473
64,Twitter Web Client,Oklahoma leads the country in incarceration rates! This is unacceptable. It is time to pursue criminal justice refo… https://t.co/2kPzuLZusU,,False,Tue Sep 25 00:09:08 +0000 2018,25,1044378232450142208
11,Sprout Social,I applaud #OKleg for launching a special committee to investigate the Health Department’s mismanagement of at least… https://t.co/Ahc4cu1VZ6,,False,Tue Nov 21 03:28:31 +0000 2017,4,932812943519043586
2,Twitter for iPhone,Thanks for hosting me! #okc https://t.co/r3dw1FSnWi,,False,Mon Jan 08 16:40:25 +0000 2018,0,950406850348048385
65,Tweetbot for Mac,"Polls open in 10 minutes! I’ve shared my vision for turning Oklahoma around, and putting us on the path to being a… https://t.co/Mmzi6XWPF7",,False,Tue Aug 28 11:56:35 +0000 2018,22,1034409406103003136
120,Twitter for iPhone,Kevin is the ONLY candidate in this race who can deliver the change we all want. We are tired of coming in last pla… https://t.co/LeYru9fLN0,,False,Thu Oct 18 22:20:24 +0000 2018,30,1053048176050126848
36,Twitter Web Client,"""I support Kevin Stitt for governor because he is a man of integrity."" – Shelly #JointheTurnaround #VoteStitt https://t.co/SHSSaVAqbc",,False,Fri Aug 17 13:45:43 +0000 2018,10,1030450606073425920
73,Twitter for iPhone,Honored to speak to and take questions from firefighters out in SE Oklahoma yesterday! https://t.co/9LOMkflJOz,,False,Sun Sep 16 14:39:13 +0000 2018,19,1041335703035101185
47,Tweetbot for Mac,"Thanks for joining the team, Rep. Cockroft. Let's get Oklahoma's turnaround started right here, right now! https://t.co/20bl4q00AY",,False,Thu Aug 23 20:24:53 +0000 2018,12,1032725383995695106
8,joe.sentry,".@POTUS gave an excellent speech at the American @FarmBureau convention yesterday. With approximately 78,000 farms… https://t.co/7XXeoVnPrI",,False,Tue Jan 09 23:30:05 +0000 2018,2,950872334990180352
6,Tweetbot for Mac,"Will you be in Oklahoma City on Friday, June 22? If so, join us at our Get Out The Vote Rally and hear my wife Sara… https://t.co/wh1lViTAJ7",,False,Wed Jun 13 15:33:11 +0000 2018,1,1006922436003196928
2,Twitter Web Client,I appreciate Tom Coburn’s leadership for putting this Oklahoma Taxpayer Platform together. OK can be a Top Ten stat… https://t.co/F6nWLTwsJb,GovStitt,False,Wed Mar 28 18:49:48 +0000 2018,1,979068052011614208
0,TweetDeck,"""A Health Dept official started to hear complaints from contractors unrelated to the renovation that the Health Dep… https://t.co/NmnhAxBIEL",GovStitt,False,Mon Apr 16 19:39:06 +0000 2018,0,985965830415544320
77,Twitter for iPhone,Enjoyed walking in my alma mater OSU’s homecoming parade this morning! Thank you to @SenatorLankford &amp; Cindy for jo… https://t.co/7oWIiMPbCl,,False,Sat Oct 27 19:53:07 +0000 2018,21,1056272603114024960
29,Twitter for iPhone,I enjoyed working out with Tulsa’s first responders this morning! My company is proud to support the men and women… https://t.co/bXUNRPMYbE,,False,Wed Aug 22 16:38:05 +0000 2018,8,1032305920859099136
89,Twitter Web Client,My opponent’s response to being 10 points down in the polls was to turn my name into a vulgar term that resemble th… https://t.co/tq4hzbqryb,,False,Wed Aug 22 16:43:09 +0000 2018,47,1032307195562676224
11,Twitter for iPhone,Thankful for the Oklahoma families on #TeamStitt that are part of our blockwalking efforts! #JointheTurnAround &amp;… https://t.co/ZV50Pejnb6,,False,Sun Jun 10 19:34:53 +0000 2018,4,1005896100945985542
68,Tweetbot for Mac,"We're counting down the days until the General Election, and we're counting on you to show off your support! Downlo… https://t.co/cmWPIOSnu5",,False,Fri Sep 14 15:08:49 +0000 2018,14,1040618378266902529
11,Twitter for iPhone,We couldn’t have asked for better weather for block walking today in 5 different OK cities! We have 3 more… https://t.co/OhqeD5vNvJ,,False,Sun May 06 00:07:02 +0000 2018,0,992918623395155969
27,TweetDeck,We have been gathering and working our cattle this weekend! I am proud of the hard work my kids put into caring for… https://t.co/5CJwUXkXPi,,False,Sat Mar 24 21:29:06 +0000 2018,3,977658587773390848
7,Tweetbot for Mac,"ICYMI: Yesterday, I filed as a Republican candidate for #okgov, and I spoke with the Oklahoman about how I am ready… https://t.co/HMnQumzqv5",,False,Fri Apr 13 18:05:29 +0000 2018,2,984855103470530560
8,Twitter Web Client,I enjoyed talking to @theadanews about how we are going to fix the mess at our State Capitol! Change will not come… https://t.co/L0DtB1vELZ,,False,Thu Dec 21 17:39:48 +0000 2017,4,943898813156216835
260,Twitter Web Client,"In 2017, my wife and I prayed and felt God call us to submit ourselves to the process of running for #okgov.  What… https://t.co/faC6ICVkal",,False,Sun Sep 30 19:14:04 +0000 2018,92,1046478303236886528
19,Tweetbot for Mac,I’m excited to have Heisman Trophy winner and OU legend Steve Owens on Team Stitt! I love his passion for Oklahoma… https://t.co/Se4EKCeJDk,,False,Wed Mar 14 21:57:07 +0000 2018,3,974041760979738624
32,TweetDeck,"I’m tired of Oklahoma coming in last place and I know you are
 too. It’s time to end politics as usual in our state… https://t.co/Vdqx7zCwDW",,False,Thu Aug 23 00:56:43 +0000 2018,10,1032431404389462017
7,joe.sentry,"""What I love about Kevin Stitt is that he is not going to be out there making decisions for the next reelection or… https://t.co/jvc0H3nPCR",,False,Fri May 25 14:01:09 +0000 2018,2,1000013908311191552
6,joe.sentry,"Momentum for our movement continues to grow! I appreciate John, Dan and Kaci for bringing together his friends and… https://t.co/iIQHqW24KK",,False,Wed Dec 20 14:00:06 +0000 2017,2,943481136080138241
11,Tweetbot for Mac,"Since the day my campaign launched, I’ve made clear that we need to reform our education system. Our teachers are u… https://t.co/23YnghHlKC",,False,Wed Jan 24 14:48:33 +0000 2018,4,956176905815969792
5,Twitter for iPhone,It was great to be back in Guthrie today! I enjoyed a Missy’s cinnamon roll and coffee and appreciated the opportun… https://t.co/w16Nuxni4l,,False,Sat Mar 10 21:03:00 +0000 2018,1,972578592650559488
15,Twitter Web Client,"""Kevin is the right person to make changes for our state. Kevin will be sure to get teachers’ raises &amp; will put tax… https://t.co/BewMqW0n9t",,False,Fri Jun 15 15:55:04 +0000 2018,6,1007652720461959169
20,Twitter for iPhone,Thankful for the many volunteers who are out today with us block walking and making calls to GOTV.… https://t.co/U45gPW12P7,,False,Sat Jun 23 16:40:38 +0000 2018,3,1010563288978083840
9,Twitter for iPhone,Appreciate the great turn out tonight at one of our Tulsa meet and greets! Enjoyed meeting Oklahomans who are ready… https://t.co/4HINFQhcJl,,False,Wed Mar 28 23:18:03 +0000 2018,2,979135557845569541
13,Twitter for iPhone,Our OKC crew just wrapped up their #TeamStitt Day of Action! #stitt4gov #ChangeIsComing https://t.co/W45lfVhRU0,,False,Sat Apr 14 19:42:34 +0000 2018,3,985241923362443264
1,Twitter Web Client,Tom Coburn hits on very important points that people have shared at my town halls across all 77 counties. It is why… https://t.co/tv4Cnu6itb,,False,Wed Mar 28 18:49:47 +0000 2018,1,979068048303943681
15,Tweetbot for Mac,If we want to make OK a Top Ten state we need to elect an outsider with fresh ideas. I’m running for #okgov to focu… https://t.co/6wDkeRJYQi,,False,Mon Mar 12 14:32:24 +0000 2018,4,973205068278386688
26,joe.sentry,"Thanks for joining the team, Commissioner Doak. Let's get Oklahoma's turnaround started right here, right now! https://t.co/y3vHS4ttya",,False,Tue Aug 28 00:00:04 +0000 2018,6,1034229089706672129
20,TweetDeck,The Trump administration’s tax cuts are spurring explosive growth nationwide. This is creating huge opportunity for… https://t.co/Qpj5ygNExh,,False,Wed Aug 08 01:10:38 +0000 2018,8,1026999091673407488
3,Twitter for iPhone,I appreciate Corbin for stepping in for me at this important forum. Wish I could be in two places at once! https://t.co/yKp23emyel,,False,Tue Feb 27 16:26:36 +0000 2018,0,968522767531413504
6,Twitter for iPhone,"Yesterday, we held four public meetings in Ellis County &gt; Harper County &gt; Woods County &gt; Major County. While on the… https://t.co/VFAoGuSeNb",,False,Fri Jan 05 17:16:11 +0000 2018,2,949328688579039234
11,TweetDeck,Thank you to the GOP Women's Club of Tulsa County for hosting the governor's forum this week! Sarah and I enjoyed g… https://t.co/9915X9lw6L,,False,Fri Feb 16 22:04:59 +0000 2018,2,964621656772800512
25,joe.sentry,EARLY VOTING IS OPEN! Head to your County Election Board to make your voice heard in the #okgov runoff today. I’d a… https://t.co/mp2f1hYRdT,,False,Thu Aug 23 12:55:06 +0000 2018,11,1032612192158400512
0,TweetDeck,Are you reading this piece by the Oklahoman?! We must not accept this as the norm for state government!,GovStitt,False,Mon Apr 16 19:42:42 +0000 2018,0,985966735546347521
15,TweetDeck,Great snap shot of our Tulsa volunteers today helping Get out the Vote! It isn't too late to volunteer. Contact us… https://t.co/STBT7rqpoi,,False,Sat Jun 23 18:32:52 +0000 2018,4,1010591535593873408
